Hashtag,Timestamp
世卫官员点赞中国返城复工疫情防控,2020-02-19 01:16:25.326643
全国新增治愈出院首次超过新增确诊,2020-02-19 01:31:58.625385
武汉非新冠肺炎特殊患者救治医院名单,2020-02-19 01:52:38.765497
600名务工人员免费坐高铁复工,2020-02-19 02:50:01.544100
新冠肺炎女童出院跳舞感谢医护,2020-02-19 03:05:09.923318
北京新增6例新型肺炎,2020-02-19 03:45:33.878034
实探郑州富士康复工,2020-02-19 03:45:33.878327
浙江多地包机免费接工人返岗,2020-02-19 03:50:37.795581
西藏连续20天无新增病例,2020-02-19 03:55:44.132030
新加坡严惩违反居家隔离制度者,2020-02-19 04:05:50.202078
疫情防控严禁过度执法粗暴执法,2020-02-19 04:21:01.032607
韩国新增15例新型肺炎,2020-02-19 04:21:01.032671
2次检测阴性出院后又确诊,2020-02-19 04:26:09.528519
浙江推出中药预防疫病推荐方,2020-02-19 04:26:09.528576
钻石公主号首批约500名乘客下船,2020-02-19 04:51:29.985657
中山大学给湖北籍学生发慰问金,2020-02-19 04:51:29.985713
全国8地新增病例降为零,2020-02-19 05:11:43.875850
运送新冠肺炎患者的志愿司机,2020-02-19 05:16:45.822870
一线医生如何给眼镜止雾,2020-02-19 05:52:09.739780
复工后的状态,2020-02-19 06:12:37.937113
15名澳籍乘客拒撤离钻石公主号,2020-02-19 06:27:54.192084
山东医疗队馒头吃播,2020-02-19 06:38:11.768576
滴滴将给全国网约车安装防护膜,2020-02-19 06:38:11.768639
新冠肺炎诊疗方案第六版,2020-02-19 07:19:54.602944
治愈患者写在药盒上的感谢信,2020-02-19 07:24:57.040358
武汉居民生活物资由社区统一采购分发,2020-02-19 07:35:06.905463
高速交警向支援湖北运输车敬礼,2020-02-19 07:50:56.821673
新冠肺炎诊疗方案增加康复者血浆治疗,2020-02-19 08:36:50.766805
日本奥运大臣称赛事活动正常进行,2020-02-19 08:36:50.766965
复工复产和稳岗就业工作情况,2020-02-19 08:46:58.826075
口罩产能利用率超100%,2020-02-19 08:52:02.442030
日本公布钻石公主号感染者国籍,2020-02-19 08:57:04.496280
企业如何保证复工员工健康,2020-02-19 09:17:45.014111
俄罗斯全面禁止中国公民入境,2020-02-19 09:28:11.144635
北京大中小学3月初开学不实,2020-02-19 09:33:25.082228
钻石公主号下船中国同胞乘包机返港,2020-02-19 09:48:38.023140
中国队因疫情退出戴维斯杯,2020-02-19 09:53:42.162580
保持医务人员合理休息,2020-02-19 10:19:24.096278
江苏开学时间,2020-02-19 10:19:24.096892
钻石公主号47名中国同胞确诊,2020-02-19 10:54:54.720453
多所高校为湖北籍学生发补助金,2020-02-19 11:05:08.081841
因干扰破坏疫情防控北京刑拘19人,2020-02-19 11:15:12.737490
武汉第八医院院长王萍感染新冠肺炎,2020-02-19 11:30:28.176880
援鄂一线医务回应被剃光头,2020-02-19 11:56:00.168560
武汉除抗疫和特殊用途车辆一律禁行,2020-02-19 12:01:13.526393
全国查扣假劣口罩2500余万只,2020-02-19 12:11:27.756236
武汉病毒所致信全所职工和研究生,2020-02-19 12:22:12.371613
日本神户大学教授录制告发视频,2020-02-19 12:37:29.289745
全球科学家发表声明反对阴谋论,2020-02-19 12:42:31.907092
云南首例新冠肺炎死亡病例,2020-02-19 12:47:35.936405
穿脱防护服有多麻烦,2020-02-19 12:52:40.349199
疫情结束后出街的我们,2020-02-19 12:57:45.743511
常用消毒用品中毒表现,2020-02-19 13:02:48.451683
医务人员强制报告个人健康状况,2020-02-19 13:07:54.231287
韩国多名邪教徒确认感染新冠病毒,2020-02-19 13:18:02.736759
治愈出院后第2和第4周到医院随访复诊,2020-02-19 13:23:17.209318
钻石公主号累计确诊621例新冠肺炎,2020-02-19 13:23:17.209375
患者出院后应与家人分餐饮食,2020-02-19 13:23:17.209432
伊朗首例新冠肺炎病例,2020-02-19 13:58:46.638283
钟南山回应新冠肺炎药物使用,2020-02-19 14:09:06.081247
男子离汉回京瞒报致母亲确诊,2020-02-19 14:50:29.723303
小汤圆爸妈出院,2020-02-19 15:05:47.310108
湖南开学时间,2020-02-19 15:15:59.855772
武汉实施城市下水道消毒,2020-02-19 15:31:26.512384
武汉协和西院31名重症患者出院,2020-02-19 15:36:28.098606
厚劳大臣把钻石公主号乘客放回去了,2020-02-19 15:36:28.098768
抚州一线医务人员子女中考加20分,2020-02-19 15:41:33.768772
钟南山联手哈佛大学攻坚新冠病毒,2020-02-19 15:56:46.349578
金韩彬送中国粉丝数万只口罩,2020-02-19 15:56:46.349704
武汉要求各区负责人签责任状,2020-02-19 16:01:52.620870
日本政府回应教授控诉钻石公主号,2020-02-19 16:22:07.116313
鄂州发布回应派出所分发物资,2020-02-19 16:22:07.116370
方舱医院小品合集,2020-02-19 17:40:25.751677
290人涉疫情犯罪被检察机关提起公诉,2020-02-20 00:10:29.868940
奚桓 老年患者心理最需疏导,2020-02-20 00:10:29.869000
疫情过后想做的第一件事,2020-02-20 00:15:31.350452
湖北新增349例新冠肺炎,2020-02-20 00:25:38.742185
王辰 新冠病毒有可能长期存在,2020-02-20 00:45:47.666889
康复者捐献血浆享无偿献血待遇,2020-02-20 00:50:49.395985
湖北累计治愈出院人数过万,2020-02-20 00:50:49.396090
湖北新增病例降至三位数,2020-02-20 00:50:49.396203
方舱医院医生感慨医患关系回来了,2020-02-20 00:55:53.747187
航拍雪过天晴的武汉,2020-02-20 01:26:11.551789
医务人员是英雄也是血肉之躯,2020-02-20 01:41:19.118040
游客讲述钻石公主号船上经历,2020-02-20 02:16:38.656817
方舱医院的动人瞬间,2020-02-20 02:36:47.447615
39岁民警抗疫一线牺牲,2020-02-20 02:46:52.650823
原解放军被服厂转产防护服,2020-02-20 02:46:52.650883
钻石公主号第二批乘客下船,2020-02-20 02:57:01.985347
陕西河北医疗队机场偶遇互道加油,2020-02-20 02:57:01.985402
新冠肺炎重症救治难度比SARS高,2020-02-20 02:57:01.985457
全国多地无新增确诊病例,2020-02-20 02:57:01.985513
湖北3月份部分考试推迟,2020-02-20 03:07:08.286071
江苏无新增确诊病例,2020-02-20 03:12:11.733963
全国新增394例新冠肺炎,2020-02-20 03:32:30.134629
疫情在家学会了什么,2020-02-20 03:32:30.134757
全国累计确诊新冠肺炎74576例,2020-02-20 03:32:30.134826
C罗为中国祈祷,2020-02-20 03:37:31.677087
医护小姐姐下意识撩头发,2020-02-20 03:57:45.939166
韩国新增新冠肺炎31例,2020-02-20 04:02:50.264207
为什么武汉新增病例高于湖北全省,2020-02-20 04:02:50.264332
活捉一枚快乐的防疫小可爱,2020-02-20 04:12:58.326792
钻石公主号2名新冠肺炎感染者死亡,2020-02-20 04:12:58.326854
北京市将补贴受疫情影响的影视项目,2020-02-20 04:12:58.326935
内蒙古无新增新冠肺炎确诊病例,2020-02-20 04:23:10.428013
多地优待一线医务子女入学,2020-02-20 04:38:49.420560
全国13地新增病例为0,2020-02-20 04:59:43.110308
多家车企转产医疗物资,2020-02-20 04:59:43.110365
钻石公主号部分港澳同胞乘包机抵港,2020-02-20 05:09:51.974818
湖北省委书记省长致信兄弟省区市,2020-02-20 05:09:51.975015
湖北以外新增病例16连降,2020-02-20 05:14:54.231156
中方向日本捐赠核酸检测试剂盒,2020-02-20 05:24:58.358589
北京华联超市回应口罩500元一盒,2020-02-20 05:35:04.600233
武体方舱医院上演地道战,2020-02-20 05:40:06.144702
疫情过后女生们的刘海,2020-02-20 05:45:09.476843
湖北A级景区5年内对援鄂医护免票,2020-02-20 05:50:20.451499
青海连续14天无新增病例,2020-02-20 05:50:20.451690
浙江最小新冠肺炎患者治愈出院,2020-02-20 06:16:08.178211
春节前的你和复工后的你,2020-02-20 06:21:09.721772
病毒没有国界之分,2020-02-20 06:36:22.400674
李英爱讲述中国抗疫故事,2020-02-20 06:56:44.211567
武汉15个区交卷,2020-02-20 06:56:44.211694
日本教授删除邮轮视频并道歉,2020-02-20 07:01:47.604809
上海最小新冠肺炎患者出院,2020-02-20 07:06:53.580662
北京3月份部分考试推迟,2020-02-20 07:11:55.129914
世卫组织 新冠病毒来自动物界,2020-02-20 07:32:36.884995
独守大桥每晚点亮武汉加油,2020-02-20 07:42:41.515681
超1000家景区对医护人员免费,2020-02-20 08:03:04.630256
疫情过后最想去哪里,2020-02-20 08:03:04.630320
确诊老师在武汉方舱医院直播开课,2020-02-20 08:13:23.293927
阶段性降低职工医疗保险费,2020-02-20 08:18:26.743289
以为每天上传体温就够傻的了,2020-02-20 08:44:11.723890
痊愈后肺功能会受影响吗,2020-02-20 09:10:20.414270
武汉中心医院急诊科主任艾芬辟谣,2020-02-20 09:25:32.116284
病毒会在头发上滞留吗,2020-02-20 09:35:41.129791
确诊和疑似患者都实行先救治后结算,2020-02-20 09:35:41.129847
武汉扫楼上门拉网式大排查,2020-02-20 09:35:41.129907
日本厚劳大臣发布会咳嗽,2020-02-20 09:45:48.182817
冯录召 病毒通过衣物传染人的几率极低,2020-02-20 09:50:53.532391
地铁票是否会传播病毒,2020-02-20 09:55:56.190707
东京马拉松向中国跑者致歉,2020-02-20 10:11:35.041132
医务人员补贴发放不受编制限制,2020-02-20 10:11:35.041265
宁波返岗专列的硬核保障,2020-02-20 10:28:02.045062
29例外国公民在华确诊新冠肺炎,2020-02-20 10:28:02.045119
复兴医院聚集性病例情况,2020-02-20 10:33:12.553931
中西医结合治疗新冠肺炎有效,2020-02-20 10:38:15.595050
武汉实行双测温两报告制度,2020-02-20 10:48:21.612710
北大人民医院确诊3例新冠肺炎,2020-02-20 10:53:27.807061
95岁清华物理系教授直播授课,2020-02-20 10:53:27.807167
浙江首个新冠肺炎死亡病例,2020-02-20 10:53:27.807267
中央指导组成员哀悼疫情逝者,2020-02-20 10:58:33.442356
韩国首例新冠肺炎死亡病例,2020-02-20 10:58:33.442550
进口口罩超12亿只,2020-02-20 10:58:33.442614
中国棋手赴俄参赛不受入境禁令影响,2020-02-20 10:58:33.442743
湖北企业不早于3月10日24时复工,2020-02-20 11:19:12.152983
卫健委回应为何取消临床诊断病例,2020-02-20 11:39:24.733425
中方紧急向日本捐赠核酸检测试剂,2020-02-20 11:44:26.617585
与未戴口罩感染者交谈不到3分钟被感染,2020-02-20 12:09:45.094277
疑似或确诊孕产妇产检定点医院,2020-02-20 12:19:51.759048
火神山患者相约康复后捐血浆,2020-02-20 12:25:45.406835
中央指导组约谈武汉有关负责人,2020-02-20 12:30:48.475169
一线医务人员补助不受编制身份限制,2020-02-20 12:41:25.101197
首批钻石公主号邮轮香港居民抵港,2020-02-20 12:41:25.101310
四川巴中查获野生动物制品1千余斤,2020-02-20 13:06:39.389940
方舱医院首次单日出院人数破百,2020-02-20 13:26:53.328343
卫健委 救治压力正逐步减轻,2020-02-20 13:31:55.371009
医务人员因工作感染认定为工伤,2020-02-20 13:31:55.371139
李兰娟脸上的压痕,2020-02-20 13:37:04.027954
疫情相关的8个好消息,2020-02-20 13:47:23.850009
晚安短信湖北计划,2020-02-20 14:43:10.048861
哈尔滨两区县领导防疫不力被免职,2020-02-20 14:43:10.048987
战疫医护人员专用表情包,2020-02-20 14:53:17.352589
重庆调拨20万毫升血浆增援湖北,2020-02-20 15:13:36.577974
湖北要求救助特殊困难群体,2020-02-20 15:23:44.118672
美方找到疫苗和药物开发关键靶点,2020-02-20 15:39:06.168146
免费对医护开放的景区名单,2020-02-20 15:39:06.168218
1月份全国生猪生产稳步恢复,2020-02-20 15:59:23.419734
浙江出院患者占确诊病例超半数,2020-02-20 16:35:19.428224
丽江旅游行业恢复营业,2020-02-20 17:56:21.870053
日本累计确诊728例新冠肺炎,2020-02-21 00:09:47.751032
河南学校3月1日后开学,2020-02-21 00:19:52.780244
首个新冠病毒原子图,2020-02-21 00:35:49.052018
日本暂不强制取消大型活动,2020-02-21 00:45:52.524117
韩国确认发生超级传播,2020-02-21 00:45:52.524482
湖北新增411例新冠肺炎,2020-02-21 00:56:00.870012
美股,2020-02-21 00:56:00.870124
四川景区恢复开放须实名制购票,2020-02-21 01:16:45.225768
武汉训斥医护人员患者被停职检查,2020-02-21 01:21:56.374561
健忘症爷爷打扫方舱医院,2020-02-21 01:32:27.197068
延迟婚期的武汉医生感染离世,2020-02-21 01:59:34.447977
湖北多地新增病例少于10,2020-02-21 01:59:34.448767
首批6000份面部防护贴送往火神山医院,2020-02-21 02:09:41.773336
给武汉无偿送菜回乡被骂瘟神,2020-02-21 02:14:44.769479
韩国三军都发现确诊感染者,2020-02-21 02:29:53.847578
钻石公主号首批香港居民接受强制检疫,2020-02-21 02:29:53.847637
全国累计确诊新冠肺炎75465例,2020-02-21 02:29:53.847695
浙江新增28例新型肺炎,2020-02-21 02:39:57.850559
浙江省十里丰监狱确诊27例新冠肺炎,2020-02-21 02:45:10.710194
武汉床位数量最多的方舱医院,2020-02-21 02:50:13.773900
江苏连续两天无新增确诊病例,2020-02-21 02:50:13.773961
韩国新增52例新冠肺炎,2020-02-21 03:10:55.557500
湖北以外地区新增病例出现反弹,2020-02-21 03:10:55.557556
同心抗疫检察官携手同行,2020-02-21 03:26:03.971058
山东新增202例新型肺炎,2020-02-21 03:31:06.651257
武汉凡人小林,2020-02-21 03:41:10.417575
济宁任城监狱确诊200例,2020-02-21 03:46:13.420477
官方回应与感染者交谈不到3分钟被感染,2020-02-21 03:56:18.160642
青海新冠肺炎确诊患者清零,2020-02-21 04:06:22.709607
疫苗最快4月下旬申报临床试验,2020-02-21 04:06:22.709667
周琪 新冠病毒不能通过皮肤侵入人体,2020-02-21 04:21:33.841238
韩国医院5名护士确诊新冠肺炎,2020-02-21 04:26:37.894769
50余名治愈患者集体出舱,2020-02-21 04:41:53.870383
西藏连续22天无新增病例,2020-02-21 04:46:57.726453
超过100名康复者献出血浆,2020-02-21 04:52:00.077429
山东浙江多人因疫情防控不力被免职,2020-02-21 05:02:07.219548
全国14地新增病例为0,2020-02-21 05:02:07.219606
日本多所大学拒绝感染者参加考试,2020-02-21 05:07:08.993160
国家卫健委回应疫情拐点,2020-02-21 05:22:46.625731
新增治愈数连续3天超过新增确诊数,2020-02-21 05:32:52.349096
血浆治疗整体效果不错,2020-02-21 05:32:52.349154
伊朗,2020-02-21 05:47:58.700266
武汉训斥医护人员患者道歉,2020-02-21 05:47:58.700385
一治愈者出院10日后复检出核酸阳性,2020-02-21 05:53:04.213629
湖北订正新冠肺炎疫情数据,2020-02-21 06:08:25.643674
湖北监狱部门报告220例确诊病例,2020-02-21 06:29:04.793278
江苏校园采取封闭式管理,2020-02-21 06:44:25.633888
复工后晒盒饭大赛,2020-02-21 06:59:53.130618
日本取消奥运会相关峰会,2020-02-21 07:04:55.181173
武汉女子监狱监狱长被免职,2020-02-21 07:04:55.181228
杜富国妹妹驰援武汉,2020-02-21 07:20:10.641178
官方回应出院10日后复检出核酸阳性,2020-02-21 08:01:55.324436
开发疫苗的5条技术路线在同步推进,2020-02-21 08:06:57.996829
防疫期6人躲宾馆赌博,2020-02-21 08:06:57.996890
为了复工各显神通,2020-02-21 08:32:25.562835
浙江省司法厅回应监狱新增病例,2020-02-21 09:08:05.165878
明确要求避免社区防控简单化一刀切,2020-02-21 09:18:34.054511
南京10个月大确诊患者出院,2020-02-21 09:28:44.030092
没有发生监狱在押罪犯感染死亡病例,2020-02-21 09:28:44.030153
韩国累计确诊204例新冠肺炎,2020-02-21 09:33:47.314919
中央政法委调查组赴山东,2020-02-21 09:44:29.850871
分类分区分级恢复交通秩序,2020-02-21 09:49:33.238273
将依法查处打击疫情中不文明现象,2020-02-21 09:54:37.184836
日本将恢复从中国进口口罩,2020-02-21 10:04:47.429814
湖北已经核减病例必须全部加回,2020-02-21 10:09:48.971621
监狱确诊病例跟其他患者一样隔离救治,2020-02-21 10:09:48.971735
援助湖北医疗队未发生感染,2020-02-21 10:14:53.822164
武汉7148个小区全面封闭,2020-02-21 10:19:57.602679
武汉核酸检测能力达2万人次每天,2020-02-21 10:24:59.755080
外交部谈中日双方抗击疫情互动,2020-02-21 10:45:55.661812
3月起江苏初高中继续线上教学,2020-02-21 11:01:02.044635
武汉计划再建19家方舱医院,2020-02-21 11:11:35.781410
北京一确诊病例复工期间密切接触66人,2020-02-21 11:37:22.247255
中国男足世预赛将在泰国举行,2020-02-21 11:42:26.250330
15.9万农民工包车运输返岗,2020-02-21 11:52:30.960688
武汉医生彭银华,2020-02-21 12:13:02.659479
出院10天阳性或因取样差异,2020-02-21 12:53:26.278858
武汉出现明显床等人现象,2020-02-21 13:03:30.671552
7类返京人群免隔离14天,2020-02-21 13:03:30.671614
狱警刻意隐瞒去武汉行程,2020-02-21 13:03:30.671676
企业员工感染新冠肺炎不能认定工伤,2020-02-21 13:24:12.249592
日本白色恋人暂停生产,2020-02-21 13:24:12.249706
援汉一线医护每工作10天休息不少于2天,2020-02-21 13:24:12.249763
火神山医护花式鼓励患者,2020-02-21 13:39:19.254878
伊朗新增13例新冠肺炎,2020-02-21 13:49:22.923487
日本新冠肺炎确诊人数达737人,2020-02-21 14:19:39.128980
中共中央政治局研究疫情防控工作,2020-02-21 14:24:43.019782
武汉又一位医生因感染新冠肺炎离世,2020-02-21 14:45:02.172946
全国疫情发展拐点尚未到来,2020-02-21 14:50:04.501979
韩总统府十几名内部警卫被隔离,2020-02-21 15:25:19.855224
火箭军为战疫医护送爱心餐,2020-02-21 15:51:19.445009
以色列确诊首例新冠肺炎病例,2020-02-21 16:11:41.508856
武汉市社会福利院共确诊12例,2020-02-21 16:42:01.749731
钻石公主号乘客下船结束,2020-02-21 16:47:03.907627
护士杜富佳,2020-02-21 17:07:14.550981
核酸阴性不能排除新冠感染,2020-02-22 00:10:49.430154
新冠肺炎英文名修订为COVID-19,2020-02-22 00:30:57.773588
周星驰给前线医疗队加油,2020-02-22 00:30:57.773644
湖北订正19日确诊病例数,2020-02-22 00:35:59.491819
世卫组织专家小组周六前往武汉,2020-02-22 00:35:59.491970
打工夫妻治愈后携手捐血浆,2020-02-22 00:41:00.993944
日本最大时装秀组委会称将如期举行,2020-02-22 01:11:13.437163
男子不想上班谎称妻女确诊,2020-02-22 01:11:13.437218
意大利新增17例新冠肺炎病例,2020-02-22 01:16:15.673712
美国新冠肺炎病例达34例,2020-02-22 01:31:21.766088
武汉市核酸检测存量全面清零,2020-02-22 01:41:25.714799
全国累计确诊新冠肺炎76288例,2020-02-22 01:56:32.678217
湖北新增366例新冠肺炎,2020-02-22 01:56:32.678330
疫情统计不允许核减已确诊的病例,2020-02-22 02:11:39.222531
全国新增397例新冠肺炎,2020-02-22 02:16:41.482992
白岩松 信息公开就是最好的疫苗,2020-02-22 02:31:48.759576
韩国新增142例新冠肺炎病例,2020-02-22 02:31:48.759690
彭银华医生妻子发声,2020-02-22 02:41:52.517966
全国累计治愈出院超2万,2020-02-22 02:46:54.763612
浙江十里丰监狱新增确诊病例2例,2020-02-22 02:51:57.423282
日本官员称东京奥运会将如期举行,2020-02-22 03:02:03.073732
六成日本民众呼吁取消奥运,2020-02-22 03:17:10.111179
世界最高速口罩机广州投产,2020-02-22 03:22:11.653490
韩国疫情,2020-02-22 03:27:14.216669
日本欢迎中国队奥运前赴日集训,2020-02-22 03:27:14.216732
湖北连续3天新增出院超新增确诊,2020-02-22 03:32:16.061014
火神山ICU里的90后护士,2020-02-22 03:52:25.870977
如果学校再不开学,2020-02-22 03:57:28.013191
首尔禁止大规模集会,2020-02-22 03:57:28.013471
黑龙江无新增确诊病例,2020-02-22 03:57:28.013528
全国18地新增病例为0,2020-02-22 04:07:31.991026
违规分配捐赠物资派出所长被停职,2020-02-22 04:12:34.007090
我着急复工的真实原因,2020-02-22 04:32:43.684182
蓝天救援队队员抗疫时遇车祸身亡,2020-02-22 04:32:43.684249
武汉跑单王18天送1125单外卖,2020-02-22 04:32:43.684309
四川广元市民卸口罩扎堆喝茶,2020-02-22 04:37:46.250502
疫情期间你的改变,2020-02-22 04:57:56.515156
新冠肺炎发病前两天已有传染性,2020-02-22 05:08:00.390308
护士长累到扶墙,2020-02-22 05:13:03.248596
武汉市委原秘书长蔡杰被双开,2020-02-22 05:28:10.752777
钟南山团队从尿液中分离出新冠病毒,2020-02-22 05:38:18.675980
韩国决定暂不升级传染病警报等级,2020-02-22 05:48:23.263735
安徽确诊新冠肺炎乘务员活动轨迹,2020-02-22 06:18:39.704847
内蒙古甘肃医疗队机场相遇隔空加油,2020-02-22 06:18:39.704904
东京都知事回应伦敦接手奥运言论,2020-02-22 06:33:46.402100
神农架新增一确诊病例潜伏期27天,2020-02-22 07:14:03.145206
援汉医疗队水上酒店提供1469个床位,2020-02-22 07:19:05.711103
张文宏医生硬核复工指南,2020-02-22 07:34:50.447435
武汉儿童医院医护隔离服上的卡通画,2020-02-22 08:15:18.452597
确诊病例存量正加速消化,2020-02-22 08:45:38.004087
火神山医院71名康复患者出院,2020-02-22 08:50:40.160585
女军医曾感染非典今再上前线,2020-02-22 08:50:40.160644
浙江疫情防控发布会,2020-02-22 08:55:42.119329
上海治愈4名新冠肺炎重症患者,2020-02-22 09:00:44.809279
快递行业复工率66.7%,2020-02-22 09:05:46.356582
累计进口超50亿元医疗物资,2020-02-22 09:26:04.033729
韩国新增87例新冠肺炎,2020-02-22 09:46:15.109014
浙江第一批疫苗已产生抗体,2020-02-22 09:51:17.187497
援鄂N95口罩共计295万只,2020-02-22 09:56:18.732219
当当网负责人因员工确诊新冠肺炎被约谈,2020-02-22 10:01:23.200336
武汉商贸流通用工缺口1万人,2020-02-22 10:56:56.479066
伊朗新增10例新冠肺炎,2020-02-22 11:12:03.717679
武汉健康码上线,2020-02-22 11:27:18.002452
杭州药店恢复销售治疗发烧咳嗽药品,2020-02-22 11:27:18.002577
湖北婴幼儿奶粉保有量1600吨,2020-02-22 11:27:18.002703
一般不要对居室进行全面消毒,2020-02-22 12:08:07.769132
交警被晒成口罩脸,2020-02-22 12:23:15.305517
武汉治愈出院患者统一隔离14天,2020-02-22 12:28:17.311960
许凯为医护人员加油,2020-02-22 12:38:28.926659
华南海鲜市场并非新冠病毒发源地,2020-02-22 12:43:31.676037
中央指导组在湖北的27天,2020-02-22 12:58:37.867729
日本15000人戴口罩看足球赛,2020-02-22 13:03:41.034919
米卢为中国加油,2020-02-22 13:08:45.018126
全球航司将损失290亿美元收入,2020-02-22 13:18:50.490302
钻石公主号23名下船者未经病毒检测,2020-02-22 13:39:09.859241
武汉隔离环卫工退房后自觉打扫酒店,2020-02-22 14:40:29.651388
三星韩国工厂确诊1例新冠病例,2020-02-22 14:50:33.868856
火神山医院ICU病床上的军礼,2020-02-22 15:25:53.606235
日本累计报告763例确诊病例,2020-02-22 15:51:13.971233
日本出现首例下船后确认感染病例,2020-02-22 16:11:50.313391
钟南山给广东驰援湖北医务人员打气,2020-02-23 00:26:18.596875
上海世界500强投资企业复工率近90%,2020-02-23 00:31:20.977497
北京医疗机构需拆除门诊大厅门帘,2020-02-23 00:31:20.977726
湖北新增630例新冠肺炎,2020-02-23 00:36:22.750882
如果再不复工,2020-02-23 00:46:26.523350
山西医疗队人手一瓶老陈醋,2020-02-23 00:46:26.523661
意大利累计确诊76例新冠肺炎,2020-02-23 01:06:34.940248
首尔市长劝市民解散遭围攻,2020-02-23 01:21:41.422256
武汉战疫31天数据日志,2020-02-23 01:36:46.528838
中国首款可重复使用口罩,2020-02-23 01:46:50.741657
武汉通报5起违反疫情防控纪律典型案例,2020-02-23 01:46:50.741720
治愈出院为啥还要隔离14天,2020-02-23 01:56:54.334450
北京无新增确诊新冠肺炎病例,2020-02-23 02:17:02.294705
方舱医院患者日记,2020-02-23 02:32:08.249812
浙江无新增新冠肺炎确诊,2020-02-23 02:37:10.043148
韩国累计确诊556例新冠肺炎,2020-02-23 02:47:14.070375
日本新确诊26例新冠肺炎,2020-02-23 02:57:17.922141
全国累计确诊新冠肺炎76936例,2020-02-23 03:07:21.828538
韩国出现第四例死亡病例,2020-02-23 03:22:28.356423
疫情不影响北京冬奥筹办,2020-02-23 03:47:41.960670
央视专访美国病毒猎手,2020-02-23 03:47:41.960729
张文宏呼吁疫情后给医生减负,2020-02-23 03:52:44.247480
武汉公交司机聂三华,2020-02-23 04:02:48.595855
妻子脱下防护服丈夫进入隔离病区,2020-02-23 04:07:50.142927
隔离期老人从医院逃回家吃面,2020-02-23 04:07:50.143040
IMF预计2020年中国经济增速为5.6%,2020-02-23 04:22:58.581478
上海治愈出院率破74%,2020-02-23 04:53:41.093987
黄山恢复开放只来了1位游客,2020-02-23 04:53:41.094043
韩国最小确诊患者4岁,2020-02-23 04:58:42.635672
韩国赴以访问团回国后9人确诊,2020-02-23 05:18:51.288761
你期待开学的真实原因,2020-02-23 05:28:56.040457
超5000人昨日涌向西湖断桥,2020-02-23 05:44:04.371709
疫情期间的学生有多难,2020-02-23 05:59:15.999212
71岁老华侨买4万个口罩捐祖国,2020-02-23 05:59:15.999293
哪些日常消毒法不靠谱,2020-02-23 06:29:56.742339
70岁大爷委托医生送玫瑰给老伴,2020-02-23 06:34:59.641062
北京多处地标亮灯致敬医护人员,2020-02-23 07:50:54.197780
武汉29岁女医生感染新冠肺炎去世,2020-02-23 08:00:58.884044
周杰伦为医护粉丝加油,2020-02-23 08:11:03.169346
全国连续3天治愈出院超两千人,2020-02-23 08:16:06.872479
黄冈90岁最高龄患者治愈出院,2020-02-23 08:16:06.872537
牺牲在抗疫一线的人民警察,2020-02-23 08:21:10.034662
安徽撤销所有公路检疫站点,2020-02-23 08:31:14.580063
韩国将疫情预警上调至最高级别,2020-02-23 08:41:19.278447
公安机关严厉打击利用疫情哄抬物价,2020-02-23 09:06:39.157099
电影院复工准备,2020-02-23 09:06:39.157157
