Hashtag,Timestamp
广东新增境外输入确诊病例5例,2020-03-25 03:37:34.205669
武汉部分公交地铁恢复运营,2020-03-25 03:37:34.205915
苹果捐赠900万个N95口罩,2020-03-25 03:42:37.261286
快船4亿美元收购新球馆,2020-03-25 03:42:37.261437
热干面醒了,2020-03-25 03:47:39.118403
离鄂通道打开的瞬间,2020-03-25 03:57:44.761763
2021年游泳世锦赛将择期进行,2020-03-25 04:02:48.051331
美国病毒猎手确诊新冠肺炎,2020-03-25 04:02:48.051432
中国留英学生戴口罩遭殴打,2020-03-25 04:07:49.899152
武汉首个桥梁工程复工,2020-03-25 04:12:52.144626
在家呆了两个月的你,2020-03-25 04:22:57.029131
武汉大学战疫宣传片,2020-03-25 04:33:02.002801
特朗普想在复活节前开放美国,2020-03-25 04:43:06.719628
志村健确诊新冠,2020-03-25 04:53:11.891474
意大利爷爷为隔离老伴唱情歌,2020-03-25 05:03:17.341855
纽约州长批联邦政府抗疫不力,2020-03-25 05:03:17.342268
塞尔维亚在中国专家建议下建方舱医院,2020-03-25 05:08:21.166087
中国第三批赴意大利抗疫专家组启程,2020-03-25 05:13:24.738058
三地推行周末2.5天假,2020-03-25 05:13:24.738209
意大利扣押1840套呼吸器具,2020-03-25 05:18:27.268423
贵州旅游景区各类餐馆全面开放,2020-03-25 05:48:44.265924
韩国新冠肺炎累计确诊9137例,2020-03-25 06:14:26.535828
武汉市城区疫情评估等级降为中风险,2020-03-25 06:29:36.302484
戏精演员居家隔离的日常,2020-03-25 06:29:36.302745
好莱坞6月档电影延期,2020-03-25 06:34:38.830319
菲律宾抬棺材硬核宣传防疫,2020-03-25 06:59:50.971434
长沙KTV等娱乐场所恢复营业,2020-03-25 06:59:50.971888
成都熊猫基地恢复开放,2020-03-25 07:04:54.161274
唐斯母亲确诊新冠肺炎,2020-03-25 07:09:58.924569
意大利美国确诊病例数均超5万,2020-03-25 07:15:02.169003
日本新冠肺炎单日新增病例创新高,2020-03-25 07:20:05.043751
火神山护士抱冰块降温,2020-03-25 07:30:11.058625
武汉阳台小女孩大喊谢谢贵州医疗队,2020-03-25 07:55:24.992968
美国参议院就两党刺激计划达成协议,2020-03-25 08:10:35.416107
世卫组织总干事呼吁G20团结战疫,2020-03-25 08:25:43.992897
华盛顿暂停非必要营运,2020-03-25 08:50:58.382719
德奥委会主席自我隔离,2020-03-25 08:50:58.382855
北大专家建议发放1000元消费券,2020-03-25 09:06:07.056225
全球足球运动员共发声,2020-03-25 09:11:10.639327
英国人排长队抢麦当劳最后一餐,2020-03-25 09:21:15.658094
俄罗斯派运输机迎接中国物资,2020-03-25 09:26:17.729567
通信大数据行程卡可查14天内行程,2020-03-25 09:36:24.513912
境外回国飞机上应戴N95口罩,2020-03-25 09:51:34.470864
瑞士酒店推出新冠肺炎疫情特别套餐,2020-03-25 09:56:43.528438
武汉小吃大赏,2020-03-25 10:01:45.460569
疫情期间新建4G5G基站超6.3万个,2020-03-25 10:01:45.460629
湖北介绍解除离鄂通道管控情况,2020-03-25 10:06:48.065300
盖茨称宁愿牺牲经济也要守护生命,2020-03-25 10:16:52.088897
境外输入高风险国家名单调整为25个,2020-03-25 10:16:52.088968
首批800余名滞留湖北人员抵京,2020-03-25 10:16:52.089038
德国累计确诊31554例,2020-03-25 10:31:59.169657
黑龙江省应急响应调整为三级,2020-03-25 10:31:59.169754
佩洛西反对特朗普重启经济,2020-03-25 10:37:01.720438
钟南山团队入围国家科学技术奖提名,2020-03-25 10:37:01.720590
塞尔维亚奶奶阳台遛狗,2020-03-25 10:37:01.720740
钟南山向欧洲国家分享经验,2020-03-25 10:37:01.720846
27日武汉外所有通道卡点全部撤除,2020-03-25 10:42:05.061855
严防境外疫情输入和境内疫情反弹,2020-03-25 10:42:05.062084
2万多名北京师生和教职员工滞留湖北,2020-03-25 10:47:07.585788
香港累计确诊升至410例,2020-03-25 10:52:10.220403
武汉4月8日起恢复商业客运航班,2020-03-25 11:07:17.782772
央视评回国女子大闹机场,2020-03-25 11:12:22.085605
马布里解除隔离被居委会称赞,2020-03-25 11:17:25.171045
新疆师范大学回应开学争议,2020-03-25 11:22:27.224614
德国开始收治意大利重症患者,2020-03-25 11:27:30.091388
西班牙88岁奶奶双手颤抖缝口罩,2020-03-25 11:32:31.950846
中小企业复工率达71.7%,2020-03-25 11:32:31.951304
东京拆除倒计时钟,2020-03-25 11:37:34.638719
查尔斯王子核酸检测呈阳性,2020-03-25 11:52:42.015024
中国蓝盔用集装箱改建发热门诊,2020-03-25 12:07:50.663876
英国女王,2020-03-25 12:17:55.234563
西班牙单日新增7937例新冠肺炎,2020-03-25 12:22:58.025764
援鄂夫妻38天未见机场拥抱,2020-03-25 12:28:00.195849
欧盟公路物流濒临崩溃,2020-03-25 12:38:06.239870
马德里冰宫改作停尸间,2020-03-25 12:43:08.605438
无法确认查尔斯王子在哪感染病毒,2020-03-25 12:53:13.348961
钟南山建议保持防控措施防第二波,2020-03-25 13:18:25.298478
武磊核酸检测呈阴性,2020-03-25 13:28:32.425268
雷神山医院首个病区患者清零,2020-03-25 13:39:08.556861
麻生太郎吐槽欧洲,2020-03-25 13:49:14.465461
特朗普有意在复活节复工,2020-03-25 13:54:16.988967
乌克兰全境进入紧急情况,2020-03-25 13:59:19.252656
梅西为抗击疫情捐款100万,2020-03-25 13:59:19.253046
戴口罩的社交安全感,2020-03-25 13:59:19.253149
英国女王3月12日见过查尔斯王子,2020-03-25 14:09:24.441151
瑞典环保少女自称极可能感染新冠,2020-03-25 14:19:29.229431
纽约市1天近3000名警察请病假,2020-03-25 14:24:31.141273
巴赫称东京奥运没限定在夏季,2020-03-25 14:55:29.276439
口罩出口订单大增,2020-03-25 15:11:48.608271
英国警察用大喇叭劝晒太阳市民回家,2020-03-25 15:16:51.220798
中国画版钟南山,2020-03-25 15:21:55.448424
参与圣火采集职员确诊新冠肺炎,2020-03-25 15:21:55.448720
美国多名医生警告情况正在恶化,2020-03-25 15:26:57.526939
驻英大使谈查尔斯王子核酸阳性,2020-03-25 15:32:01.206750
援鄂护士如愿坐上铁骑摩托车,2020-03-25 15:32:01.207052
普京宣布俄罗斯放假一周,2020-03-25 15:37:03.543014
印度医生因抗疫遭歧视,2020-03-25 15:37:03.543121
智能测温AR眼镜两分钟测百人,2020-03-25 15:37:03.543339
四川开学时间,2020-03-25 15:42:10.139143
加拿大西捷航空将裁员6900人,2020-03-25 15:47:12.701447
普京称将推迟俄宪法修正案全民公投,2020-03-25 16:12:25.231978
西班牙副首相新冠病毒检测呈阳性,2020-03-25 18:40:15.754498
武磊方辟谣核酸检测呈阴性,2020-03-26 00:23:05.986557
中国以外新冠肺炎超33万例,2020-03-26 00:23:05.986708
美国新冠肺炎确诊病例已达62086例,2020-03-26 00:28:08.030070
滞留湖北需要进京人员近20万,2020-03-26 00:28:08.030420
新疆高校4月8日起分批错峰开学,2020-03-26 00:28:08.030663
英国一名高级外交官因患新冠肺炎去世,2020-03-26 00:33:11.078641
世界面临疫情防控的第二个窗口期,2020-03-26 00:33:11.079093
安徽开学时间,2020-03-26 00:48:19.037728
法国因新冠肺炎疫情从伊拉克撤军,2020-03-26 00:53:21.335190
首批援意医疗专家组启程回国,2020-03-26 00:58:23.761546
钻石公主号驶离日本横滨港,2020-03-26 00:58:23.761976
受疫情影响的国家和地区为196个,2020-03-26 00:58:23.762130
意大利又一护士因感染自杀,2020-03-26 01:03:25.607270
北京发热患者全部核酸检测,2020-03-26 01:03:25.607539
疫情报道翻车现场,2020-03-26 01:08:28.036239
美国航母3名水兵确诊新冠肺炎,2020-03-26 01:13:30.620818
31省区市新增67例均为境外输入,2020-03-26 01:18:33.117879
云南新增2例境外输入病例,2020-03-26 01:38:42.771871
内蒙古新增12例境外输入病例,2020-03-26 01:38:42.772022
支援湖北尸检医生感谢遗体捐献者,2020-03-26 01:43:45.103473
印度未在家隔离市民被罚深蹲,2020-03-26 01:43:45.103548
保释阿桑奇的申请遭伦敦法庭拒绝,2020-03-26 01:48:47.341520
第三批中国抗疫医疗专家组抵达米兰,2020-03-26 01:53:50.143006
俄罗斯新冠肺炎确诊病例超600例,2020-03-26 01:53:50.143139
河北1人境外返回不报备被立案,2020-03-26 01:58:52.627165
中国医护人员将赴意组建野战医院,2020-03-26 01:58:52.627252
31省区市现有确诊降至4000例以下,2020-03-26 02:03:55.906749
意大利累计确诊病例超7万,2020-03-26 02:03:55.906851
北京对首例关联病例深入流调溯源,2020-03-26 02:08:58.135440
美国第三轮紧急经济救助计划遭遇波折,2020-03-26 02:08:58.135504
靠声音眼神认出彼此的夫妻再次相拥,2020-03-26 02:24:04.361589
马云称不应对求救呼声冷嘲热讽,2020-03-26 02:24:04.361685
武汉有了烟火气,2020-03-26 02:29:06.343855
上海第三批支援湖北医疗队启程返沪,2020-03-26 02:39:11.265479
意大利新增死亡病例683例,2020-03-26 02:44:13.668084
美国7个州成为疫情重大灾区,2020-03-26 02:59:21.157035
江苏新增境外输入病例2例,2020-03-26 02:59:21.157209
驻外美军暂停部署60天,2020-03-26 02:59:21.157295
纽约新冠肺炎确诊病例数破2万例,2020-03-26 03:24:32.955584
美航母又有5名水手检测呈阳性,2020-03-26 03:24:32.955736
中国已宣布向83个国家提供援助,2020-03-26 03:44:43.745778
意大利外长说加入一带一路能救命,2020-03-26 03:44:43.745912
福建开学时间,2020-03-26 03:44:43.746047
重庆回赠韩国釜山6万只口罩,2020-03-26 03:49:45.815241
意大利违反规定出行最高可罚3000欧元,2020-03-26 03:54:51.305339
多国各种形式感谢中国雪中送炭,2020-03-26 04:09:59.386517
蓬佩奥G7外长会再提武汉病毒,2020-03-26 04:09:59.386665
中国已向5国派出7批专家组,2020-03-26 04:09:59.386964
江西南昌购车给1000元补助,2020-03-26 04:09:59.387115
中国将及时与全球共享数据成果,2020-03-26 04:25:05.636032
纽约市长称或有一半市民感染新冠病毒,2020-03-26 04:30:07.711306
北京将流感须戴口罩写进法条,2020-03-26 04:30:07.711380
境外输入确诊病例90%持中国护照,2020-03-26 04:50:17.951407
志村健装人工心肺治疗,2020-03-26 04:55:20.510809
钟南山战疫60天全记录,2020-03-26 05:00:23.455873
纽约男子无人机给女子传电话号码,2020-03-26 05:00:23.455951
巴西总统要求地方政府停止封锁,2020-03-26 05:05:25.553624
中国将帮助巴基斯坦建隔离医院,2020-03-26 05:10:27.572802
美国新冠肺炎死亡超千人,2020-03-26 05:15:29.896236
九寨沟3月31日恢复开放,2020-03-26 05:15:29.896390
美参议院通过2万亿美元经济救助计划,2020-03-26 05:20:32.883923
江西暂停所有出入境国际客运航班,2020-03-26 05:25:35.011600
霉霉捐助经济困难粉丝,2020-03-26 05:35:39.884688
苹果考虑推迟发布5GiPhone,2020-03-26 05:35:39.884794
湖人主场或将改造成方舱医院,2020-03-26 05:40:42.894922
玻利维亚宣布进入紧急状态,2020-03-26 05:50:50.835236
专家表示会严管无症状感染者,2020-03-26 05:55:53.089139
研究显示1月1日起病毒已在意大利传播,2020-03-26 05:55:53.089247
中国对外援助原则,2020-03-26 06:00:55.438941
人民币对美元汇率中间价两连涨,2020-03-26 06:00:55.439089
美国一养老院94人或全部感染,2020-03-26 06:00:55.439239
英国新冠肺炎确诊病例数逼近1万,2020-03-26 06:05:58.925037
对外援助首先保证国内需要,2020-03-26 06:11:01.380816
美国商务部延长对华为意见征询期,2020-03-26 06:11:01.380930
中国政府如何确定向哪些国家提供援助,2020-03-26 06:16:03.439744
中国已和多国合作开展疫苗研发,2020-03-26 06:21:06.264672
联合国发起新冠肺炎全球响应计划,2020-03-26 06:31:11.368612
大连出现首例境外输入确诊病例,2020-03-26 06:36:13.763768
日本确诊病例增至1313例,2020-03-26 06:36:13.763916
纽约市长说别信特朗普虚幻的希望,2020-03-26 06:46:19.387554
武汉数百列动车组准备就绪,2020-03-26 06:51:21.793789
武汉的新冠肺炎重症治愈率越来越高,2020-03-26 06:51:21.793938
英国女子进充气球一路滚进超市,2020-03-26 06:51:21.794088
英国超40万志愿者报名抗疫,2020-03-26 06:56:24.203371
英国科学团队推荐中国应对疫情政策,2020-03-26 07:01:26.615989
马克龙戴口罩视察重灾区,2020-03-26 07:01:26.616144
外交部回应美方抹黑言论,2020-03-26 07:01:26.616313
国足核酸检测全部为阴性,2020-03-26 07:06:28.884545
英国重症患者录视频警醒民众,2020-03-26 07:11:32.983427
和保安叔叔互测体温,2020-03-26 07:31:43.305500
延迟开学的当代大学生,2020-03-26 07:46:50.947693
计划从境外来鄂人员至少提前2天申报,2020-03-26 07:46:50.947993
澳大利亚传生姜泡水预防新冠,2020-03-26 07:51:53.714297
纽约医院外搭临时停尸房,2020-03-26 07:51:53.714383
英国计划再建10个方舱医院,2020-03-26 08:07:02.640079
英国商家严禁员工戴口罩,2020-03-26 08:12:13.566656
美国向各国征购医疗物资,2020-03-26 08:12:13.571899
英国小女孩因中餐馆关闭崩溃大哭,2020-03-26 08:17:15.704326
国家卫健委提醒做好持久防控准备,2020-03-26 08:37:28.282720
巴基斯坦新冠肺炎确诊病例数破千,2020-03-26 08:37:28.284077
湖北省治愈率首次突破90%,2020-03-26 08:37:28.284242
武警小哥满足单身女护士心愿,2020-03-26 08:37:28.284394
意大利疫情新闻发言人发烧,2020-03-26 08:47:33.620308
武汉正在重启,2020-03-26 08:47:33.620614
恩比德声援唐斯,2020-03-26 08:47:33.620721
已有23个省份报告境外输入病例,2020-03-26 08:52:37.692027
邓超孙俪邀医护粉丝撕名牌,2020-03-26 08:52:37.692448
郑允浩发明的口罩获专利,2020-03-26 09:02:44.145803
中国回赠意大利100倍口罩,2020-03-26 09:07:47.110169
首都机场多家航空公司转至大兴机场,2020-03-26 09:12:50.181357
主唱用意大利面做热干面,2020-03-26 09:12:50.181461
东京奥运延期已售门票仍可以使用,2020-03-26 09:12:50.181563
北京境外输入超六成来自英国西班牙,2020-03-26 09:12:50.181665
中国第一个向意大利提供医疗物资,2020-03-26 09:27:58.773723
近期部分航班可能变更或取消,2020-03-26 09:27:58.773874
上海首批205家影院将复市,2020-03-26 09:38:03.608447
武昌医院护士长突发脑溢血昏迷,2020-03-26 09:38:03.608551
上海推出观影立补10元活动,2020-03-26 09:43:07.223296
餐饮业复工率达80%,2020-03-26 09:43:07.223448
中国向蒙古国援助防疫物资,2020-03-26 09:48:10.993053
意大利市民按姓氏首字母外出购物,2020-03-26 10:03:19.528772
湖北返京人员集中观察费用自付,2020-03-26 10:08:21.449944
演员苏朵儿疑似感染新冠,2020-03-26 10:08:21.450011
耿爽批蓬佩奥再提武汉病毒,2020-03-26 10:08:21.450077
世界最高建筑亮灯警示待在家里,2020-03-26 10:08:21.450143
杨幂向海外捐赠物资,2020-03-26 10:13:23.508707
大卫芬奇给学生上网课,2020-03-26 10:33:36.190304
日本多地知事呼吁民众别去东京,2020-03-26 10:33:36.190747
德国高考仍将按计划举行,2020-03-26 10:38:39.873456
张伟丽滞留美国哭诉想家,2020-03-26 10:38:39.873630
超市商场等复工率超90%,2020-03-26 10:38:39.873805
入境上海全部人员一律隔离14天,2020-03-26 10:53:49.454841
塞尔维亚首个方舱医院完工,2020-03-26 11:03:55.265184
入境山东人员一律转乘飞机集中隔离,2020-03-26 11:03:55.265356
伊朗全国近六成人口受检,2020-03-26 11:19:04.072285
詹姆斯致敬医护人员,2020-03-26 11:19:04.072860
国家大剧院取消4月演出及相关活动,2020-03-26 11:24:06.636826
西班牙绝症双胞胎呼吁人们乖乖在家,2020-03-26 11:29:08.924618
留学生实拍澳大利亚抢厕纸,2020-03-26 11:39:13.984522
国防部敦促美方停止网络窃密活动,2020-03-26 11:59:25.060238
乘客打喷嚏飞行员翻窗逃走,2020-03-26 11:59:25.060387
日本拟向收入减少家庭发现金,2020-03-26 11:59:25.060598
印度花式惩罚违反防疫禁令者,2020-03-26 11:59:25.060701
印度民众连夜抢购,2020-03-26 11:59:25.061069
英国征用宠物呼吸机治疗人类,2020-03-26 12:04:27.893658
医院回应抗疫护士脑出血昏迷,2020-03-26 12:04:27.894254
特朗普高尔夫俱乐部新冠感染关系网,2020-03-26 12:29:41.101242
日本考虑发行肉票和鱼票,2020-03-26 12:34:43.868274
整个社区隔窗为女孩唱生日歌,2020-03-26 12:34:43.868404
西班牙累计确诊病例超5万,2020-03-26 12:34:43.868509
俄罗斯禁飞常规航班与包机,2020-03-26 12:34:43.868611
印度官员推荐撒牛粪防疫,2020-03-26 12:34:43.868720
俄罗斯版火神山医院,2020-03-26 12:44:49.283762
全球网络带宽告急,2020-03-26 12:54:53.476824
纽约大学医学生提前毕业参与抗疫,2020-03-26 12:54:53.476904
民航局要求继续调减国际客运航班量,2020-03-26 13:20:05.378018
意大利军车教堂外排队运遗体,2020-03-26 13:20:05.378290
纽约医生镜头下的急诊室,2020-03-26 13:20:05.378427
留学生亲历上海防疫闭环,2020-03-26 13:30:10.353927
汪小菲酒店成为防疫旅馆,2020-03-26 13:40:16.023585
抵离中国航班客座率不高于75%,2020-03-26 13:45:19.150549
新冠疫苗首批志愿者的接种手记,2020-03-26 13:45:19.150666
防控境外疫情经陆路水路输入风险,2020-03-26 13:50:22.317485
在英留学生记录回国路,2020-03-26 14:10:34.230020
库里将与专家探讨疫情,2020-03-26 14:10:34.230168
湖北介绍稳岗就业复工复产情况,2020-03-26 14:10:34.230316
上网课时的三种状态,2020-03-26 14:10:34.231060
你眼中武汉的春天,2020-03-26 14:15:38.226503
意大利当周或将迎来疫情拐点,2020-03-26 14:15:38.227098
纽约等待检测人群大雨中排长队,2020-03-26 14:20:41.451350
美国累计确诊近7万例,2020-03-26 14:20:41.451453
美国管乐队在超市给卫生纸奏哀乐,2020-03-26 14:25:44.066338
日本奥运30金目标不变,2020-03-26 14:25:44.067222
中国将为世界经济稳定作出贡献,2020-03-26 14:40:50.732156
张文宏答留学生华侨华人抗疫问题,2020-03-26 14:50:55.416753
美国首次申领失业救济人数创新高,2020-03-26 15:01:02.310439
广东明确境外入粤政策包含港澳台,2020-03-26 15:16:12.468078
意大利已有37名医生死于新冠肺炎,2020-03-26 15:16:12.468274
纽约医护人员用垃圾袋当防护服,2020-03-26 15:21:15.762930
美国年轻人瞎混就是最大感染风险,2020-03-26 15:56:38.509131
安倍称疫情为国难,2020-03-26 15:56:38.509401
湖北随州实现新冠肺炎患者清零,2020-03-26 16:01:41.310236
工程师日行3万步调试327台呼吸机,2020-03-26 16:11:46.516600
医院ICU恢复探视第一天,2020-03-26 16:21:51.995203
暂停持有效中国签证的外国人入境,2020-03-26 16:47:10.356092
特斯拉将重开纽约工厂制造呼吸机,2020-03-26 18:28:06.392050
美国新冠肺炎确诊病例超8万,2020-03-27 00:11:03.956135
意大利新冠肺炎确诊病例超8万,2020-03-27 00:11:03.956215
G20将启动5万亿美元提振经济计划,2020-03-27 00:21:08.978998
意大利超6千医务人员感染新冠肺炎,2020-03-27 00:36:17.089985
部分新冠病毒抗体已在药监局报备,2020-03-27 00:36:17.090131
全球新冠肺炎累计达465915例,2020-03-27 00:36:17.090279
武汉人的快乐回来了,2020-03-27 00:41:19.127507
美股暴涨,2020-03-27 00:51:23.524295
美国新冠肺炎疫情何时出现拐点,2020-03-27 01:06:29.526338
美国一名医护人员感染新冠去世,2020-03-27 01:06:29.526418
亚航宣布暂停大部分航班,2020-03-27 01:21:36.944436
到底为什么会有无症状感染者,2020-03-27 01:31:43.322085
浙江新增1例本土病例,2020-03-27 01:41:47.524267
13地新增54例境外输入病例,2020-03-27 01:41:47.524324
穿成独角兽逛超市,2020-03-27 01:41:47.524381
伊朗陆军方舱医院内部画面,2020-03-27 01:51:51.636699
上海昨日新增境外输入17例,2020-03-27 02:01:56.450401
新冠特效药还有多远,2020-03-27 02:01:56.450555
泰国人防疫大赏,2020-03-27 02:06:58.527215
湖北在院治疗人数降至三千以下,2020-03-27 02:12:01.301801
泰国父亲为儿子剪防疫发型,2020-03-27 02:17:03.528213
武汉无疫情小区占比97.1%,2020-03-27 02:17:03.528289
皇马将伯纳乌改为医疗物资分发中心,2020-03-27 02:17:03.528374
钟南山连线美国专家团队,2020-03-27 02:17:03.528451
张文宏说不外出闲逛比囤药强,2020-03-27 02:27:08.835913
苏醒中的武汉什么样,2020-03-27 02:27:08.836065
武汉1万多家餐饮店恢复外卖,2020-03-27 02:27:08.836233
美国罗斯福号航母上25人确诊,2020-03-27 03:17:34.170484
巴勒斯坦艺术家N95口罩作画,2020-03-27 03:22:37.448623
离汉回京瞒报感染母亲男子被批捕,2020-03-27 03:32:43.164709
特朗普回应美国失业人数猛增328万,2020-03-27 03:32:43.165225
英国累计确诊病例破万,2020-03-27 04:03:21.066227
意大利超5000名医护感染原因,2020-03-27 04:33:34.590893
武汉60家医院恢复医疗资源,2020-03-27 04:38:37.414798
英国将向个体经营者补助八成盈利,2020-03-27 04:38:37.414947
东京奥运会纪念品大面积断货,2020-03-27 04:38:37.415245
马克布鲁姆感染新冠去世,2020-03-27 04:48:42.036235
UFC总裁批评美国人躲避病毒,2020-03-27 04:48:42.036507
美国多地急建方舱医院,2020-03-27 04:53:44.130235
韩国大邱市长晕倒,2020-03-27 04:53:44.131187
南京回应为外籍居民提供暖心服务,2020-03-27 05:28:58.970970
德国著名小提琴家感染新冠病毒,2020-03-27 05:28:58.971249
384万个口罩由中国飞往塞尔维亚,2020-03-27 05:34:01.211882
疫情中的美国华盛顿,2020-03-27 05:59:14.974816
北京师生返京要求,2020-03-27 06:04:17.538839
韩国新冠肺炎确诊病例增至9332例,2020-03-27 06:19:25.310195
武汉战友泪别新疆援鄂医疗队,2020-03-27 06:24:27.765950
菲律宾武装部队总参谋长确诊,2020-03-27 06:24:27.766084
尼泊尔封国数百登山者被困喜马拉雅山,2020-03-27 06:29:30.322396
巴西啤酒制造商改行生产洗手液,2020-03-27 06:39:35.851736
抗疫医生背后的家庭,2020-03-27 06:44:40.323987
要高度重视防治无症状感染者,2020-03-27 06:49:42.881086
首尔向新天地教会索赔2亿韩元,2020-03-27 06:49:42.881235
四川请援鄂医护免费吃一年火锅,2020-03-27 06:49:42.881387
通用汽车临时降薪两成,2020-03-27 06:54:45.992890
韩国大邱15%确诊患者嗅觉味觉丧失,2020-03-27 07:09:53.609567
黄石确诊病例全部出院,2020-03-27 07:30:04.886420
比尔盖茨喊话全美学习中国,2020-03-27 07:35:09.817641
克里姆林宫工作人员感染新冠病毒,2020-03-27 08:00:23.233888
湖南拆除鄂入湘路障,2020-03-27 08:15:30.689168
每天入境旅客将降到5000人左右,2020-03-27 08:15:30.689320
东京奥运村或变方舱医院,2020-03-27 08:20:32.680933
疫情期被没收的幺鸡回家了,2020-03-27 08:25:41.638387
尚在医学观察的密切接触者增幅78%,2020-03-27 08:36:07.980905
马德里养老院1065名老人去世,2020-03-27 08:41:10.406596
英国小哥向世界介绍中国零接触,2020-03-27 08:46:14.015091
特朗普嫌纽约州呼吸机要太多,2020-03-27 08:56:19.661096
进小区被拒后自称外国人被保安怒怼,2020-03-27 08:56:19.661206
浙江本土病例同航班有25名境外人员,2020-03-27 09:16:43.047657
今年暑假还有吗,2020-03-27 09:21:52.032672
意大利市长花式狂怼市民,2020-03-27 09:26:54.660970
发现无症状感染者四种途径,2020-03-27 09:47:08.734102
美国司法部起诉委内瑞拉总统,2020-03-27 09:52:11.364805
江苏一男子隐瞒出入境记录被立案调查,2020-03-27 10:32:40.536948
吴磊防疫套装,2020-03-27 10:37:43.620019
美军不再公布确诊细节,2020-03-27 10:42:48.926300
钟南山回应国内是否会二次暴发疫情,2020-03-27 10:47:56.985315
特朗普称美国海军医疗船将支援抗疫,2020-03-27 10:53:01.275747
钟南山称疫情震中可能转移至美国,2020-03-27 10:58:04.760681
法国高铁列车改装成医用车厢运输患者,2020-03-27 11:03:07.363893
已取得的奥运资格保留至2021,2020-03-27 11:08:10.210804
武汉将有计划解除社区封控,2020-03-27 11:18:17.682180
香港新增65例确诊病例,2020-03-27 11:18:17.682331
山西高校毕业年级预计4月10日开学,2020-03-27 11:43:34.243403
特朗普称中国对抗击新冠病毒理解深刻,2020-03-27 11:43:34.243500
耿爽称中外公民一视同仁,2020-03-27 11:43:34.243596
如各国积极防控预计4月疫情控制见效,2020-03-27 11:48:39.283020
纽交所最上镜交易员确诊新冠肺炎,2020-03-27 11:48:39.283150
李兰娟首次披露武汉封城细节,2020-03-27 11:53:41.375353
火神山抗疫表情包,2020-03-27 12:03:45.791816
将视情针对海外华人开行临时班机或包机,2020-03-27 12:08:48.129599
外国方舱医院内部画面,2020-03-27 12:13:50.388410
特朗普称美国将分区域解封,2020-03-27 12:13:50.388522
武汉患儿跨越千里来南京就医,2020-03-27 12:13:50.388636
英国首相新冠肺炎检测呈阳性,2020-03-27 12:23:56.793514
东京奥运会举办日期一个月内确定,2020-03-27 12:23:56.794042
西班牙新冠肺炎确诊患者超6万,2020-03-27 12:49:10.508942
非洲国家纷纷感谢中国援手,2020-03-27 12:49:10.509046
柬埔寨人唱刘三姐感谢中国援助,2020-03-27 12:54:13.478287
西班牙决定继续执行与易瑞生物的合同,2020-03-27 12:59:18.192466
群体免疫,2020-03-27 13:09:23.831905
全运会因奥运延期无法确定办赛时间,2020-03-27 13:09:23.832226
大型网课乱入现场,2020-03-27 13:14:26.188705
戛纳影节宫成收容所,2020-03-27 13:19:28.926424
全国影院暂不复业,2020-03-27 13:29:34.648540
中国以外累计确诊445177例,2020-03-27 13:44:45.475632
外交部复信美媒有怨气去找美国政府,2020-03-27 13:44:45.475773
美国发文鼓励各国医生赴美抗疫,2020-03-27 13:49:47.641719
印度画圈画框让人保持距离,2020-03-27 13:49:47.641815
