Hashtag,Timestamp
世贸组织总部发现新冠肺炎病例,2020-03-11 08:55:13.492884
NBA计划在疫情较轻城市比赛,2020-03-11 08:55:13.493253
巴基斯坦一架战斗机坠毁,2020-03-11 09:00:18.573778
允许受疫情影响的贫困户延期还款,2020-03-11 09:20:29.296048
韩国KBS电视台一清洁工确诊,2020-03-11 09:25:35.466735
郑州境外输入病例隐瞒行程被立案,2020-03-11 09:30:38.019858
北京4例输入病例来自意大利同一家庭,2020-03-11 09:45:46.534794
2020年全球最具创新公司,2020-03-11 10:00:54.702387
北京严格入境进京人员管理,2020-03-11 10:05:57.266894
泰国落地签,2020-03-11 10:11:04.997375
英国央行紧急降息,2020-03-11 10:11:04.997483
刚果金确诊首例新冠肺炎病例,2020-03-11 10:11:04.997538
住建部回应废弃口罩处理问题,2020-03-11 10:11:04.997593
湖北检察机关对蔡杰决定逮捕,2020-03-11 10:16:12.816808
地级市都要建医疗垃圾处理厂,2020-03-11 10:16:12.817125
特朗普坚称自己不需要检测,2020-03-11 10:31:20.754183
泰国宣布暂停18国落地签证,2020-03-11 10:31:20.754245
四川5人专家出发支援意大利,2020-03-11 10:41:25.620436
加拿大5500万个N95口罩囤过期,2020-03-11 10:56:34.405555
李兰娟 希望3月底新增病例清零,2020-03-11 11:26:49.329347
3名F1车队人员体温异常被隔离,2020-03-11 11:47:00.308097
韩国男子把39万元纸币放微波炉消毒,2020-03-11 11:57:05.462192
崔娃罗列特朗普所有预测全错,2020-03-11 11:57:05.462317
滞留湖北未返京人员将发生活费,2020-03-11 12:07:10.740773
多地明确延迟停暖不另收费,2020-03-11 12:12:12.603875
伊朗累计确诊新冠肺炎9000例,2020-03-11 12:12:12.604028
钟南山全程英语分享中国经验,2020-03-11 12:32:24.652977
东京奥组委理事称正考虑探讨是否延期,2020-03-11 12:57:38.194435
隐瞒旅居史一旦确诊将被立案,2020-03-11 12:57:38.194497
45%在韩就读中国留学生未返校,2020-03-11 13:02:40.495494
在韩中国留学生讲述现状,2020-03-11 13:07:42.709057
用歼20技术制造全自动口罩机,2020-03-11 13:07:42.709169
意大利医院床单制口罩,2020-03-11 13:12:44.642987
意大利抗疫Vlog,2020-03-11 13:22:55.005138
郑州境外回国确诊患者母亲致歉,2020-03-11 13:22:55.005199
化身售货员的护士马瑞,2020-03-11 13:22:55.005261
非疫情严重国家进京者居家观察14天,2020-03-11 13:22:55.005321
日本政府补偿学生监护人停工费用,2020-03-11 13:27:57.245596
纽约时报猛踩中国20分钟后赞意大利,2020-03-11 13:53:11.325462
意大利外长感谢中国援助,2020-03-11 14:13:25.458403
云南高三初三预定3月23日开学,2020-03-11 14:48:48.457435
网传北京4月开学系谣言,2020-03-11 14:58:57.343852
德乙汉诺威后卫确诊新冠肺炎,2020-03-11 14:58:57.344002
日本爆发两起群体感染81人确诊,2020-03-11 15:04:00.523614
西班牙确诊病例破两千,2020-03-11 15:19:10.023015
雷神山医院单日出院72人创新高,2020-03-11 15:34:44.392652
张伟丽被强制医疗停赛2个月,2020-03-11 15:44:51.112020
全国新增确诊与治愈趋势对比图,2020-03-11 15:49:54.299829
西班牙新冠肺炎确诊病例破2000,2020-03-11 15:49:54.299889
新疆高三初三3月16日开学,2020-03-11 15:49:54.299949
烤肉店复工点整本菜单,2020-03-11 16:15:10.877896
马云捐赠欧洲180万个口罩,2020-03-11 16:20:13.770224
波兰建议握手改撞肘,2020-03-11 16:20:13.770378
波兰所有学校关闭两周,2020-03-11 16:20:13.770529
武汉一社区用环卫车运送平价肉,2020-03-11 16:25:15.795368
匈牙利宣布进入紧急状态,2020-03-11 16:35:21.919440
日本新增53例新冠肺炎患者,2020-03-11 16:35:21.919552
新冠肺炎疫情已具有大流行特征,2020-03-11 18:06:20.631946
意大利新冠肺炎累计确诊12462例,2020-03-12 00:19:23.973525
尤文球员确诊新冠肺炎,2020-03-12 00:19:23.973800
伊朗第一副总统感染新冠肺炎,2020-03-12 00:34:31.456806
方舱将消毒后交还社会,2020-03-12 00:39:33.283291
中国以外累计确诊新冠肺炎37371例,2020-03-12 00:39:33.283413
意大利关闭生活必需品药品外所有商店,2020-03-12 00:44:35.564381
武汉市青山区副区长被党纪立案审查,2020-03-12 00:49:37.530497
意大利驻欧盟大使称只有中国回应我们,2020-03-12 00:59:42.354465
德国首次出现职业球员感染病例,2020-03-12 01:19:52.888682
德国扣押运往瑞士手套物资,2020-03-12 01:50:08.014414
康复患者15天内两次献血,2020-03-12 01:55:11.004810
法国新冠肺炎升至2281例,2020-03-12 01:55:11.004871
国际米兰停止一切竞技活动,2020-03-12 01:55:11.004933
英国医生看病时需共用口罩,2020-03-12 02:10:17.877509
北京对现有输入性病例开展倒查,2020-03-12 02:10:17.877943
丹麦新增252例新冠肺炎,2020-03-12 02:10:17.878053
3省份新增6例境外输入病例,2020-03-12 02:15:20.301796
菲律宾总统将进行新冠肺炎检测,2020-03-12 02:20:22.630064
美国宣布对欧洲实施旅行禁令,2020-03-12 02:30:26.998212
湖北累计治愈病例超5万,2020-03-12 02:30:26.998320
汤姆汉克斯夫妇感染新冠肺炎,2020-03-12 02:35:29.546732
特朗普发表全国讲话,2020-03-12 02:35:29.546971
韩国新冠肺炎确诊病例新增114例,2020-03-12 02:40:31.921287
NBA停赛,2020-03-12 02:50:36.802732
雷霆爵士比赛延期,2020-03-12 02:50:36.802908
戈贝尔确诊新冠肺炎,2020-03-12 02:50:36.803212
小石榴今天出院,2020-03-12 03:00:41.728991
中方分享新冠肺炎诊疗方案,2020-03-12 03:05:44.352486
加拿大万人大会出现确诊患者,2020-03-12 03:30:59.785962
湖北新增确诊降至个位数,2020-03-12 03:36:02.727751
江西全省住院确诊病例清零,2020-03-12 04:01:19.276705
硬核司机自制防疫六件套,2020-03-12 04:06:23.084871
孙正义提供肺炎检测遭日本网友恶评,2020-03-12 04:06:23.084975
穆迪埃确诊新冠肺炎,2020-03-12 04:21:30.077207
扶贫办回应贫困地区养殖野生动物,2020-03-12 04:26:32.800819
意大利男子控诉殡仪馆拒收妹妹遗体,2020-03-12 04:41:39.475809
香港部分文化设施重新开放,2020-03-12 04:41:39.475967
花木兰日本版主题曲,2020-03-12 05:01:50.293857
特朗普称有望提前解除对中国旅行预警,2020-03-12 05:06:53.790190
默克尔警告7成德国人可能会感染,2020-03-12 05:06:53.790314
美疾控中心承认一些流感死者可能患新冠,2020-03-12 05:06:53.790560
郑州大姐怒斥境外输入确诊者,2020-03-12 05:11:55.661539
日本邮政,2020-03-12 05:11:55.661655
东京奥运圣火采集,2020-03-12 05:27:06.293494
巴菲特谈美股暴跌,2020-03-12 05:47:17.182420
西班牙足协暂停所有非职业级别联赛,2020-03-12 05:47:17.182686
法国砍掉英国几百万口罩订单,2020-03-12 05:52:19.194869
泰国聚集性感染11人确诊,2020-03-12 06:02:24.649235
韩国六旬男子举镰刀打劫口罩,2020-03-12 06:12:31.424818
云南一医院放弃申领抗疫补助,2020-03-12 06:12:31.424931
沙特石油公司让员工扮移动洗手液,2020-03-12 06:47:52.565385
伊拉克国际联军遇袭2名美国人丧生,2020-03-12 06:47:52.565448
钟南山团队发布新冠肺炎防控课程,2020-03-12 06:52:54.864000
韩国海洋水产部11人确诊新冠肺炎,2020-03-12 06:52:54.864299
特斯拉成美国市值最高工业公司,2020-03-12 06:52:54.864531
英国征收数字税,2020-03-12 06:57:58.508612
意大利市长对着空荡的街头落泪,2020-03-12 07:13:07.967774
C罗将接受新冠病毒检测,2020-03-12 07:13:07.967927
丹麦学校下周起停课两周,2020-03-12 07:13:07.968079
98岁天文学泰斗已治愈,2020-03-12 07:33:19.631448
李豫峰 新冠肺炎男患者应检查生育力,2020-03-12 07:53:31.095804
意大利医生不得不决定让谁先死,2020-03-12 07:58:35.612836
上海支援湖北医务人员英雄榜,2020-03-12 08:03:39.177957
林书豪怒怼美国政客,2020-03-12 08:13:47.037698
印度女性围坐合唱抗疫,2020-03-12 08:13:47.037866
美顶级传染病专家发出警告,2020-03-12 08:29:02.790360
我国本轮疫情流行高峰已经过去,2020-03-12 08:34:09.609533
上海将扩大重点国家防疫范围,2020-03-12 08:34:09.609996
全球海平面高度达到有记录以来最高值,2020-03-12 08:34:09.610113
罗马大部分华商关店歇业,2020-03-12 08:39:20.200664
泰国猴子无人喂食为抢香蕉打架,2020-03-12 08:49:28.103785
NBA停摆损失超十亿美元,2020-03-12 08:49:28.103935
美国新冠肺炎病例数升至1281例,2020-03-12 08:59:35.106414
全国累计查获8066万只问题口罩,2020-03-12 09:14:44.583862
瑞士又被扣了手套消毒水,2020-03-12 09:24:50.225496
中国专家组带着31吨物资驰援意大利,2020-03-12 09:34:56.811846
北京设立入境进京人员集散点,2020-03-12 09:34:56.811928
意大利确诊医护仍要坚守岗位,2020-03-12 09:39:59.666815
市场监管总局回应口罩核心原料价格过高,2020-03-12 09:50:05.199359
上海博物馆3月13日起恢复对外开放,2020-03-12 09:50:05.199438
钟南山发布科研攻关最新进展,2020-03-12 10:00:11.678344
大邱2000病人在家隔离等床位,2020-03-12 10:20:28.404012
钟南山称6月份结束疫情是可以期待的,2020-03-12 10:25:30.638216
冠状病毒在温度较高的夏天比较不活跃,2020-03-12 10:25:30.638277
钟南山谈全球疫情形势,2020-03-12 10:25:30.638460
境外输入病例很多为无症状患者,2020-03-12 10:30:33.542799
美应集中精力应对疫情而不是向中国甩锅,2020-03-12 10:40:42.554424
日本邮局停止接收邮寄到中国包裹,2020-03-12 10:45:45.686139
意大利大使吐槽欧盟,2020-03-12 10:50:49.255821
菲律宾股市触发熔断机制,2020-03-12 10:50:49.256251
钟南山说国外疫情很像武汉早期情况,2020-03-12 11:05:57.133170
CinemaCon因疫情取消,2020-03-12 11:05:57.133398
首尔一栋大楼93人确诊,2020-03-12 11:05:57.133510
中国以外全球确诊新冠肺炎44483例,2020-03-12 11:16:01.720453
杭州报告一例无症状感染者,2020-03-12 11:16:01.720741
钟南山称治愈患者重复感染机会很小,2020-03-12 11:16:01.720848
我国本轮疫情流行高峰已过去,2020-03-12 11:21:03.843957
北京将向国外4城捐赠防疫物资,2020-03-12 11:36:13.027290
东京奥运首场比赛时间确定,2020-03-12 11:36:13.027351
官方回应湖北高院防疫干部醉驾撞车,2020-03-12 12:01:41.808261
库里呼吁球迷做好疫情防护,2020-03-12 12:01:41.808497
悉尼上空出现洗手字样,2020-03-12 12:06:44.378625
湖北高院防疫干部酒驾撞车,2020-03-12 12:06:44.378929
7个国家确诊病例过千,2020-03-12 12:26:53.959872
伊朗累计确诊新冠肺炎数过万,2020-03-12 12:31:56.663221
美国流感,2020-03-12 12:36:59.657380
意大利将建米兰版火神山,2020-03-12 12:42:03.065280
境外输入病例近半无发烧症状,2020-03-12 12:47:05.658481
湖北四地复工出行通告,2020-03-12 12:52:08.148776
皇马男篮球员确诊新冠肺炎,2020-03-12 12:52:08.148877
西班牙副首相妻子确诊新冠肺炎,2020-03-12 13:12:18.708513
德国确诊新冠肺炎人数破2千,2020-03-12 13:22:23.470436
口罩一戴六亲不认,2020-03-12 13:27:25.430946
西班牙市民被迫头戴塑料袋出门,2020-03-12 13:27:25.431089
日本人抢购纳豆防疫,2020-03-12 13:27:25.431234
北京海关回应青岛郑州输入病例,2020-03-12 13:32:28.577263
F1车队人员确诊新冠肺炎,2020-03-12 13:32:28.577346
钟南山团队连线美国ICU团队,2020-03-12 13:37:30.907687
医生躺在空床上如释重负,2020-03-12 13:42:33.367264
法国启动新冠肺炎疗法临床试验,2020-03-12 13:42:33.367336
欧盟谴责美国单边主义行为,2020-03-12 13:57:42.622884
中国驻韩大使馆向首尔市捐口罩,2020-03-12 13:57:42.623039
湖北高院通报干部醉驾事件,2020-03-12 14:07:48.447737
东京奥运会圣火采集成功,2020-03-12 14:12:51.223266
西班牙确诊病例增至2968例,2020-03-12 14:12:51.223341
欧盟批美单方面限制欧洲大陆人员赴美,2020-03-12 14:12:51.223489
澳大利亚累计确诊新冠肺炎144例,2020-03-12 14:27:58.838724
韩国强制要求公务员轮流居家办公,2020-03-12 14:33:02.177114
英国新冠肺炎病例增至460例,2020-03-12 14:33:02.177176
美股再度熔断,2020-03-12 14:53:14.859125
新冠肺炎AI辅助系统20秒完成CT诊断,2020-03-12 15:19:22.510872
黄金,2020-03-12 15:29:31.276604
人社部要求坚决防止企业违法裁员,2020-03-12 15:34:36.520020
印度寺庙给神像戴口罩,2020-03-12 15:34:36.520144
意大利民众出门须携带自我声明,2020-03-12 15:44:46.124494
美国国会大厦参众两院大楼关闭,2020-03-12 15:49:52.043870
联合国减少会议降低病毒传播风险,2020-03-12 15:49:52.044020
莱斯特城球员出现新冠症状,2020-03-12 15:54:55.754822
爱尔兰宣布关闭全部学校,2020-03-12 15:59:59.889105
白岩松连线中国驻意大利大使李军华,2020-03-12 16:05:04.886367
武汉医院回应用救护车拉肉,2020-03-12 16:10:07.993839
英国新增确诊134例,2020-03-12 16:10:07.993942
菲律宾,2020-03-12 16:20:14.280459
菲律宾首都马尼拉紧急封城,2020-03-12 16:20:14.280592
米切尔新冠病毒检测呈阳性,2020-03-12 16:25:20.034783
方舱医院江文洋医生,2020-03-12 16:25:20.034998
中国野生动物保护协会被处罚,2020-03-12 16:25:20.035052
希腊取消国庆节阅兵,2020-03-12 16:30:22.376245
欧洲杯推迟,2020-03-12 16:35:25.135171
意大利新增确诊2651例,2020-03-12 19:17:08.344356
巴西总统助手感染新冠肺炎,2020-03-13 00:14:26.753047
加拿大总理特鲁多自我隔离,2020-03-13 00:24:32.240618
西班牙国王王后接受新冠病毒检测,2020-03-13 00:24:32.240783
全英赛观众不测体温不戴口罩,2020-03-13 00:24:32.240950
中国以外累计确诊新冠肺炎44067例,2020-03-13 00:34:36.285180
阿森纳主帅感染新冠病毒,2020-03-13 00:44:42.192591
美国会医师预测近半数美国人可能感染,2020-03-13 00:44:42.192651
意大利新冠肺炎死亡病例破千,2020-03-13 01:04:51.380091
法国累计确诊新冠肺炎2876例,2020-03-13 01:04:51.380275
奥地利首次出现新冠肺炎死亡病例,2020-03-13 01:04:51.380431
花木兰全球撤档,2020-03-13 01:09:53.630750
寂静之地2全球撤档,2020-03-13 01:14:56.187053
意大利违反隔离规定或被判21年,2020-03-13 01:14:56.187357
湖北天门49岁民警因公牺牲,2020-03-13 01:30:03.790614
以色列确诊109例中包含6月大婴儿,2020-03-13 01:40:08.657637
美国华盛顿州下令关闭学校6周,2020-03-13 01:45:10.510376
马克龙会见西班牙国王鞠躬飞吻,2020-03-13 01:55:15.186518
美国新冠肺炎增至1459例,2020-03-13 01:55:15.186626
大学生瞒父母游13国回国发热被隔离,2020-03-13 02:05:19.888833
皇马曼城欧冠延期,2020-03-13 02:10:22.690677
国乒回国赴澳门备战,2020-03-13 02:20:27.869114
美国人疯抢卫生纸还打架引崔娃吐槽,2020-03-13 02:25:29.968629
湖北孝感回应100人在小区聚集,2020-03-13 02:25:29.968722
全球迪士尼乐园暂停营业,2020-03-13 02:30:32.489889
花木兰伦敦首映式,2020-03-13 02:35:34.371515
伊朗军队成立医疗卫生总部,2020-03-13 02:35:34.371815
白宫表示特朗普和拜登无需检测,2020-03-13 02:40:36.660842
韩国新冠肺炎增至7979例,2020-03-13 03:00:46.418404
特朗普与CNN又开撕,2020-03-13 03:05:49.243686
英国停止对轻症患者进行检测,2020-03-13 03:05:49.243857
NBA将暂停至少30天,2020-03-13 03:10:51.744563
切尔西球员奥多伊感染新冠病毒,2020-03-13 03:15:54.191784
加大拿总理妻子确诊新冠肺炎,2020-03-13 03:20:56.982396
阿森纳一线队全体球员隔离,2020-03-13 03:31:02.525378
菲律宾驻联合国外交官感染新冠肺炎,2020-03-13 03:36:04.809204
美国的检测系统达不到需求,2020-03-13 03:36:04.809277
加拿大总理妻子确诊新冠肺炎,2020-03-13 03:51:13.810691
全国新增确诊病例8例,2020-03-13 04:16:28.592471
北京新增境外输入确诊1例,2020-03-13 04:21:31.313616
全国除湖北外中小企业开工率已达60%,2020-03-13 04:21:31.313743
武汉新增5例新冠肺炎,2020-03-13 04:31:36.410147
巴西总统接受新冠病毒检测,2020-03-13 04:31:36.410208
春光中的武汉,2020-03-13 04:31:36.410331
2018位浙江援鄂医务人员全名单,2020-03-13 04:36:40.167427
中国关闭珠穆朗玛峰通道,2020-03-13 04:46:46.570720
NBA不会对戈贝尔罚款或禁赛,2020-03-13 04:51:49.844543
瑞典不再给轻症及疑似患者进行检测,2020-03-13 04:56:53.610866
隔离中的汤姆汉克斯夫妇,2020-03-13 05:06:59.425482
台湾海峡3.4级地震,2020-03-13 05:17:06.399489
美国将中国医药品从关税清单中去除,2020-03-13 05:32:14.814757
意大利民众在家高唱国歌相互鼓劲,2020-03-13 05:37:17.632753
赵立坚连发五条推文质问美国,2020-03-13 05:42:20.779634
工业企业复工复产五大难点,2020-03-13 05:52:27.349261
欧美疫情蔓延会对中国制造业带来冲击,2020-03-13 05:52:27.349343
达州婚姻登记处复工近百对预约离婚,2020-03-13 06:17:43.116071
意男子为防病毒套半径1米圆盘出门,2020-03-13 06:17:43.116395
特朗普称确诊美国人不能上飞机回国,2020-03-13 06:37:54.481115
境外意大利人讲述被歧视,2020-03-13 06:37:54.481219
菲律宾总统称考虑向中国寻求帮助,2020-03-13 06:42:59.087783
加拿大免费上门检测新冠病毒,2020-03-13 06:48:03.543767
奋战45天后在医院的最后一天,2020-03-13 06:58:10.535271
上海11例新冠患儿全部出院,2020-03-13 06:58:10.535332
网友全程记录中国包机从伊朗回国,2020-03-13 07:13:34.710731
西班牙封锁4座小镇,2020-03-13 07:18:40.796096
钟南山呼吁公众无偿献血,2020-03-13 07:18:40.796414
奥运是否取消将遵循世卫组织建议,2020-03-13 07:18:40.796563
俄亥俄州卫生部预计州内超10万人感染,2020-03-13 07:28:45.740963
江苏省新冠肺炎确诊病例全部出院,2020-03-13 07:38:51.285791
武汉百亩樱花逐次盛开,2020-03-13 07:43:54.003826
荷比卢三国新冠肺炎病例猛增,2020-03-13 07:48:57.394008
马云向美国非洲捐赠医疗物资,2020-03-13 08:19:12.927381
澳大利亚内政部长确诊感染新冠肺炎,2020-03-13 08:24:15.639962
武汉有一群仍忙碌工作的人,2020-03-13 08:29:18.448636
我国疫情防控取得阶段性重要成果,2020-03-13 08:59:36.780893
医疗队六十公里为患者买生日蛋糕,2020-03-13 09:19:52.231090
我的快乐复工了,2020-03-13 09:19:52.231359
期待开学的真正原因,2020-03-13 09:24:55.692847
日本通过可宣布国家紧急状态法案,2020-03-13 09:35:03.295368
中国可能是世界投资避险的最佳区域,2020-03-13 09:40:05.363635
2019年美国侵犯人权报告,2020-03-13 09:45:09.394841
日本警方与黑帮戴口罩缠斗20分钟,2020-03-13 09:45:09.395459
江浙沪重点外贸企业全部复工,2020-03-13 09:55:16.492010
中国支持口罩等医疗物资出口,2020-03-13 10:00:19.515959
山西最后一例新冠肺炎患者出院,2020-03-13 10:10:26.779319
国内所有苹果零售店恢复营业,2020-03-13 10:10:26.779428
中韩应对新冠肺炎疫情联防联控合作机制,2020-03-13 10:25:34.996897
中国以外超5万例新冠肺炎,2020-03-13 10:35:42.691615
北京公布英国输入病例情况,2020-03-13 10:40:46.870000
丹麦成欧洲第二个疫情封城国家,2020-03-13 10:40:46.870163
美日将携手应对新冠疫情,2020-03-13 10:45:51.860286
黄冈市域内国省县道恢复有序通行,2020-03-13 10:50:54.434362
4岁男孩捐献器官让6人新生,2020-03-13 11:01:00.681211
瑞典将不再统计新冠肺炎确诊人数,2020-03-13 11:16:10.712335
意大利网友刷屏感谢中国使馆,2020-03-13 11:21:13.745093
二十国集团就应对疫情发表声明,2020-03-13 11:26:19.319386
北京再通报郑州确诊病例郭某某情况,2020-03-13 11:36:25.605454
C罗新冠病毒检测为阴性,2020-03-13 11:41:29.426851
埃弗顿球员出现新冠症状,2020-03-13 11:46:35.145715
日本回应特朗普推迟奥运会建议,2020-03-13 11:51:37.270061
除湖北外规上工业企业开工率超95%,2020-03-13 11:56:39.796381
火神山护士孙青,2020-03-13 12:11:49.852119
新疆3月23日全面开学,2020-03-13 12:16:54.887381
湖北新冠肺炎患者治愈率达76.1%,2020-03-13 12:47:18.971085
澳大利亚确诊官员曾与伊万卡会面,2020-03-13 12:52:21.865448
目前留在湖北的师生暂缓返校,2020-03-13 12:52:21.866021
王牌对王牌致敬医护人员,2020-03-13 13:02:28.392764
全球死亡病例已超5000例,2020-03-13 13:12:35.029767
浙江发布首个儿童口罩团体标准,2020-03-13 13:47:59.080589
湖北除武汉其他市县疫情均为中低风险,2020-03-13 13:47:59.080735
全球票房损失或达百亿美元,2020-03-13 13:53:02.395719
米兰正全力搭建方舱医院,2020-03-13 13:53:02.395779
韩国意大利伊朗累计确诊总和超3万人,2020-03-13 14:08:15.496750
希腊暂停奥运圣火本国传递,2020-03-13 14:13:18.735363
小朋友戴口罩都是张着嘴的,2020-03-13 14:28:31.382824
西班牙确诊增至4209例,2020-03-13 14:28:31.382939
澳大利亚新冠肺炎病例增至156例,2020-03-13 14:48:42.679799
西班牙宣布进入紧急状态,2020-03-13 15:03:51.498661
伊朗贷款50亿美元抗疫,2020-03-13 15:03:51.498941
巴西总统新冠病毒检测阳性,2020-03-13 15:19:11.202627
1.7万吨中央储备猪肉投放,2020-03-13 15:49:30.699358
钟南山露出笑容,2020-03-13 16:19:48.209229
英国累计确诊升至798人,2020-03-13 16:24:51.272301
巴西总统称其新冠病毒检测阴性,2020-03-13 17:35:29.944564
特朗普宣布国家紧急状态应对疫情,2020-03-13 20:57:19.142961
法国所有学校从下周一开始停课,2020-03-14 00:03:49.580817
美国部分公立学校开始闭校,2020-03-14 00:03:49.580922
特朗普称将很快接受新冠病毒检测,2020-03-14 00:23:58.278082
迈阿密市长新冠病毒检测结果呈阳性,2020-03-14 00:23:58.278235
法国累计确诊新冠肺炎3661例,2020-03-14 00:39:07.083715
意大利累计确诊新冠肺炎17660例,2020-03-14 00:44:09.902572
美股大涨,2020-03-14 00:54:15.186286
C罗为抗击疫情发声,2020-03-14 00:59:17.162610
甘肃新增2例境外输入新冠肺炎,2020-03-14 01:19:27.773133
湖北潜江市民放炮庆祝解封,2020-03-14 01:19:27.773230
德甲延期,2020-03-14 01:19:27.773397
纽约州长称确诊少是因为检测落后,2020-03-14 01:24:30.869039
世卫组织宣布欧洲是全球疫情重灾区,2020-03-14 01:34:35.018602
德国多州下周起关闭学校,2020-03-14 01:49:43.222336
波兰禁止外国人入境,2020-03-14 01:54:45.292227
大学开学要继续后延,2020-03-14 01:59:47.257912
奥运火炬传递现场观众不戴口罩,2020-03-14 01:59:47.258218
中国与瘟疫的千年战争,2020-03-14 02:19:57.780655
意大利小镇居民集体隔空对唱,2020-03-14 02:19:57.781013
伊朗军队将管制街道筛查所有公民,2020-03-14 02:25:00.557243
境外入唐山隐瞒病情治疗费自担,2020-03-14 02:25:00.557432
韩国新冠肺炎累计确诊升至8086例,2020-03-14 02:25:00.557494
美国病死率高或说明很多病人没被发现,2020-03-14 02:40:07.674430
意大利首席医务官因新冠肺炎去世,2020-03-14 02:45:10.773260
隔离点解除志愿者精准还原学生寝室,2020-03-14 03:10:22.426555
阳台敲锣救母女子母亲已出院,2020-03-14 03:20:28.523467
特朗普称赞中国疫情防控成果,2020-03-14 03:20:28.523739
美国新冠肺炎确诊病例突破2000,2020-03-14 03:30:34.554592
世卫组织称任何国家都不能自暴自弃,2020-03-14 03:35:36.890693
中东版方舱医院内部画面,2020-03-14 03:40:39.016118
湖北除武汉外连续9天零新增,2020-03-14 03:45:41.582360
武汉新增4例新冠肺炎,2020-03-14 03:50:43.974245
31省区市新增确诊病例11例,2020-03-14 04:00:48.583763
湖北无新增疑似病例,2020-03-14 04:00:48.583818
湖南岳阳筛查发现5名无症状感染者,2020-03-14 04:00:48.583960
伊巴卡新冠病毒检测呈阴性,2020-03-14 04:15:56.084602
林书豪累积捐款超300万,2020-03-14 04:15:56.085113
北京新增境外输入1例,2020-03-14 04:20:58.747206
27省区市新增确诊病例为0,2020-03-14 04:20:58.747285
金婚老夫妻从重症到出院回家,2020-03-14 04:20:58.747364
全国累计报告境外输入病例95例,2020-03-14 04:41:08.422844
希腊取消东京奥运火炬传递,2020-03-14 04:41:08.422939
全球最小新冠病毒感染者,2020-03-14 04:51:27.850530
国内新冠肺炎确诊患者超80%被治愈,2020-03-14 04:56:30.584955
四川一小学未开学催家长缴学费,2020-03-14 05:01:32.755016
武汉新增病例连续3天个位数并递减,2020-03-14 05:01:32.755078
四川专家支援意大利背后的故事,2020-03-14 05:06:35.049210
马云用歌剧为意大利加油,2020-03-14 05:11:36.915078
俄罗斯建设首个方舱医院,2020-03-14 05:11:36.915140
巴西驻美大使新冠病毒检测阳性,2020-03-14 05:11:36.915203
武汉市民发现汽车长草了,2020-03-14 05:31:46.649357
库里夫妇捐款,2020-03-14 05:36:49.090336
火神山医院的特殊军礼,2020-03-14 05:36:49.090439
德国新冠肺炎确诊病例超3千,2020-03-14 06:02:01.263422
小朋友打劫式戴口罩,2020-03-14 06:12:06.739591
白宫总统医生称特朗普目前无需检测,2020-03-14 06:42:23.970601
7省区现有确诊病例清零,2020-03-14 06:42:23.970699
意大利被德国扣下的口罩找不到了,2020-03-14 06:47:27.196812
日美为东京奥运的举办合作,2020-03-14 06:47:27.197103
意大利一医院太平间超负荷,2020-03-14 07:12:39.678880
法国官方禁止百人以上集会,2020-03-14 07:37:53.704872
上海新增2例境外输入确诊病例,2020-03-14 07:42:56.806980
同事与郭某鹏一起执勤被隔离,2020-03-14 07:48:01.851793
新西兰要求海外入境人员隔离14天,2020-03-14 07:48:01.852673
撞倒广东医疗队员司机已被警方控制,2020-03-14 08:08:12.991625
苹果将关闭中国以外所有零售店,2020-03-14 08:43:33.192754
