Hashtag,Timestamp
武汉发现不明原因肺炎,2019-12-31 05:07:20.950927
武汉不明原因肺炎不能断定是SARS,2019-12-31 06:13:20.030479
武汉肺炎未发现明显人传人现象,2019-12-31 08:04:49.014840
不明原因肺炎患者转入传染病医院,2020-01-02 09:18:19.718019
武汉肺炎疫情患者被要求继续留院,2020-01-02 12:51:04.614682
武汉卫健委通报不明原因肺炎,2020-01-03 11:12:48.047206
武汉不明原因肺炎已排除SARS病原,2020-01-05 13:50:01.000699
武汉8名不明原因肺炎患者治愈出院,2020-01-08 14:09:09.880051
武汉不明原因肺炎病原体为新型冠状病毒,2020-01-09 01:41:57.488282
武汉不明原因肺炎导致1人死亡,2020-01-11 00:51:26.559012
专家解读武汉不明原因肺炎,2020-01-11 01:16:36.608933
中国已分享新型冠状病毒基因序列信息,2020-01-13 07:36:54.988409
泰国发现1例新型冠状病毒病例,2020-01-14 04:43:11.159588
武汉肺炎不排除有限人传人可能,2020-01-15 00:55:05.757212
泰国新型冠状病毒病例为武汉游客,2020-01-15 01:05:09.147575
泰国新冠状病毒患者已康复,2020-01-15 07:15:25.374700
日本确认首例新型冠状病毒病例,2020-01-16 03:06:42.850182
日本确诊首例新型冠状病毒病例出院,2020-01-16 10:56:16.033472
武汉冠状病毒肺炎新增死亡1例,2020-01-16 18:28:21.315931
泰国发现第二例新型冠状病毒肺炎患者,2020-01-17 10:11:43.483522
武汉新增4例新型冠状病毒肺炎病例,2020-01-18 00:27:42.774140
武汉病毒性肺炎5大谣言,2020-01-18 09:27:51.559414
武汉新增17例新型冠状病毒肺炎病例,2020-01-19 00:48:03.031690
专家称武汉冠状病毒肺炎总体可治,2020-01-19 04:14:57.728483
深圳肺炎,2020-01-19 06:41:38.783315
上海肺炎,2020-01-19 07:17:01.363285
武汉机场火车站检测体温,2020-01-19 10:24:11.296077
韩国现不明原因肺炎病例,2020-01-19 11:04:33.898717
上海没有发现新型冠状病毒肺炎,2020-01-19 12:30:51.551998
新型冠状病毒传染来源还未找到,2020-01-19 13:06:27.281162
上海加强对可疑病例筛查,2020-01-20 00:10:02.716578
广东确诊1例新型冠状病毒感染肺炎病例,2020-01-20 00:15:04.424814
武汉新增新型肺炎136例,2020-01-20 00:25:10.675081
北京确诊2例新型冠状病毒感染肺炎病例,2020-01-20 00:30:15.038921
武汉卫健委发布病毒性肺炎高发注意事项,2020-01-20 01:55:56.261413
深圳另有8例新型冠状病毒肺炎观察病例,2020-01-20 03:36:54.215618
浙江发现5例武汉来浙并有发热等症状患者,2020-01-20 03:46:59.281335
韩国出现一武汉肺炎确诊病例,2020-01-20 06:02:59.175239
医用外科口罩,2020-01-20 06:23:08.806934
上海对可疑病例已采取措施,2020-01-20 06:28:11.755077
北京强化新型冠状病毒肺炎病例排查,2020-01-20 07:28:49.473682
一分钟科普冠状病毒,2020-01-20 08:59:44.623543
外交部回应新型冠状病毒感染肺炎疫情,2020-01-20 09:14:54.794596
漫画科普冠状病毒,2020-01-20 09:50:12.217085
境内确诊217例新型冠状病毒肺炎病例,2020-01-20 13:07:26.407534
武汉发热门诊名单,2020-01-20 13:17:34.325207
上海确诊首例新型冠状病毒感染肺炎,2020-01-20 13:27:41.732090
钟南山谈疫情,2020-01-20 15:29:21.750201
钟南山肯定新型冠状病毒肺炎人传人,2020-01-20 15:55:01.276395
新型冠状病毒传染性比SARS弱,2020-01-20 16:10:11.603608
钟南山,2020-01-20 16:15:14.150778
有医务人员被传染新型冠状病毒肺炎,2020-01-20 16:25:42.038043
武汉15名医务人员感染新型冠状病毒,2020-01-21 00:35:41.359376
一图看懂新型冠状病毒肺炎,2020-01-21 01:05:53.552724
新型冠状病毒肺炎纳入法定传染病,2020-01-21 01:10:55.306278
陶勇医生曾帮患者减免费用,2020-01-21 02:21:34.881207
春运如何严防新型冠状病毒,2020-01-21 04:17:38.977440
同事接替陶勇医生看病,2020-01-21 04:32:45.972398
口罩,2020-01-21 05:13:09.538490
买口罩的主力军,2020-01-21 05:28:17.657223
武汉2020春节文旅惠民活动延期,2020-01-21 06:03:33.286840
武汉成立疫情防控指挥部,2020-01-21 07:24:21.951396
武汉对进出武汉人员管控,2020-01-21 07:49:32.068935
武汉制定诊疗方案,2020-01-21 09:10:27.157918
美泰加强中国游客入境检疫,2020-01-21 09:45:47.438499
浙江确诊首例新型冠状病毒肺炎,2020-01-21 11:21:33.330941
天津确诊2例新型肺炎,2020-01-21 11:41:43.128736
台湾首例肺炎患者,2020-01-21 11:56:52.921389
广州地铁体温检测,2020-01-21 12:37:14.411868
国内确诊291例新型冠状病毒肺炎病例,2020-01-21 12:42:16.008268
上海新增4例新型肺炎,2020-01-21 12:42:16.010522
武汉新型肺炎患者救治由政府买单,2020-01-21 13:02:27.334946
河南确诊首例新型肺炎,2020-01-21 13:07:30.639448
涉武汉航班机票可免费办理退票,2020-01-21 14:18:17.530883
重庆确诊5例新型肺炎病例,2020-01-21 14:33:31.103044
黄冈新增12例新型肺炎,2020-01-21 15:18:58.903002
患者给陶勇医生的评价,2020-01-21 15:18:58.903441
四川确诊首例新型肺炎,2020-01-21 16:10:06.087096
北京新增5例新型肺炎病例,2020-01-21 16:40:27.485462
全国已确诊新型肺炎病例319例,2020-01-21 17:51:23.645301
江西确诊2例新型肺炎病例,2020-01-21 19:57:31.617336
美国确诊首例新型肺炎病例,2020-01-21 20:27:43.945554
武汉疫情防控全面升级,2020-01-22 00:09:15.801737
长沙确诊首例新型肺炎病例,2020-01-22 00:39:31.883104
淘宝所有口罩不允许涨价,2020-01-22 00:44:33.609918
昆明确诊首例新型肺炎病例,2020-01-22 00:49:39.917107
国内确诊324例新型肺炎病例,2020-01-22 01:25:00.124165
协和医院骨科医生自愿支援,2020-01-22 01:25:00.125924
84岁钟南山再战防疫最前线,2020-01-22 01:35:04.206730
广东打击哄抬口罩价格行为,2020-01-22 01:55:13.000790
N95口罩,2020-01-22 02:35:30.846416
央视记者探访武汉隔离病房,2020-01-22 02:50:37.556793
湖北发布加强新型肺炎防控通告,2020-01-22 02:50:37.558072
疫情中的逆行者,2020-01-22 02:50:37.558397
武汉给市民朋友的一封信,2020-01-22 02:50:37.559024
卫健委专家组一成员被隔离,2020-01-22 03:05:43.641470
国新办回应新型肺炎,2020-01-22 03:20:51.841357
新型肺炎确诊440例死亡9例,2020-01-22 03:30:55.189596
新型肺炎病毒存在变异可能,2020-01-22 04:06:13.469361
新型冠状病毒来源是野生动物,2020-01-22 04:26:21.776798
武汉市长回应万家宴,2020-01-22 04:41:28.686586
9个关于新型肺炎最新事实,2020-01-22 04:51:33.600533
暂无证据证明已出现超级传播者,2020-01-22 05:01:40.217372
口罩商3倍工资让回厂加班,2020-01-22 05:01:40.217530
国家卫健委提示4点个人卫生建议,2020-01-22 05:57:10.053483
口罩头像,2020-01-22 06:32:30.132987
武汉火车站机场均配体温筛查仪,2020-01-22 06:32:30.133258
武汉医生的朋友圈,2020-01-22 06:52:45.295632
武汉女医生的现代版与夫书,2020-01-22 06:57:48.360496
儿童年轻人对病毒不易感,2020-01-22 07:02:50.414688
广东新确诊9例新型肺炎病例,2020-01-22 07:07:52.667795
湖北将重罚坐地起价口罩经营者,2020-01-22 07:07:52.667910
武汉市民自发退票不远游,2020-01-22 07:07:52.668026
用ECMO技术成功救治1新型肺炎患者,2020-01-22 08:13:48.392997
世界卫生组织专家组赴武汉市考察,2020-01-22 09:59:42.913603
湖北拟请求紧急支援口罩等医用物资,2020-01-22 10:35:14.744820
武汉教育局回应中小学能否按期开学,2020-01-22 10:50:25.885126
辽宁确认2例新型肺炎病例,2020-01-22 11:00:33.113074
香港首例新型肺炎,2020-01-22 11:20:43.002285
新型冠状病毒怕酒精不耐高温,2020-01-22 11:25:44.540757
福建确诊首例新型肺炎病例,2020-01-22 11:35:48.999911
野味肺炎,2020-01-22 11:45:58.599382
三部门打击野生动物违法交易,2020-01-22 11:45:58.599479
山西确诊首例新型肺炎病例,2020-01-22 12:06:13.679138
怎么劝说父母戴口罩,2020-01-22 12:21:20.094714
专家介绍新型肺炎快速救治指南,2020-01-22 12:41:31.201685
广西确诊2例新型肺炎病例,2020-01-22 13:01:42.136913
全国已确诊473例新型肺炎病例,2020-01-22 13:21:51.754645
工信部紧急协调口罩生产,2020-01-22 14:57:57.897419
武汉对进出城车辆及人员实施疫情排查,2020-01-22 14:57:57.897500
确诊患者报销后自费部分由财政补助,2020-01-22 15:13:03.971386
武汉要求全市在公共场合佩戴口罩,2020-01-22 15:28:14.445214
防范新型肺炎48字守则,2020-01-22 15:33:17.324390
新型肺炎已致湖北17人死亡,2020-01-22 16:23:14.395115
全国确诊新型肺炎病例,2020-01-22 16:28:19.690486
疫情地图,2020-01-22 16:53:38.680585
北京新增4例新型肺炎病例,2020-01-22 17:13:55.665107
江苏确诊首例新型肺炎病例,2020-01-22 17:24:03.710607
河北确诊首例新型肺炎病例,2020-01-22 17:34:08.238093
黑龙江确诊首例新型肺炎病例,2020-01-22 18:19:36.834431
黑龙江确诊首例新型肺炎,2020-01-22 18:19:36.834693
广西新增3例新型肺炎确诊病例,2020-01-22 18:29:46.630954
武汉公交地铁暂停运营,2020-01-22 19:50:31.897361
武汉机场火车站离汉通道暂时关闭,2020-01-22 20:05:38.725032
武汉封城,2020-01-22 20:10:42.077636
李兰娟回应新型肺炎6大疑问,2020-01-23 00:27:39.881045
武汉加油,2020-01-23 00:42:48.409362
武汉对进出城车辆人员进行疫情排查,2020-01-23 01:33:19.247965
抗疫一线90后护士的手,2020-01-23 01:38:22.563880
医护人员齐喊武汉必胜,2020-01-23 01:53:32.288072
湖北主持人戴口罩播报,2020-01-23 02:08:38.468247
17例新型肺炎死亡病例病情公布,2020-01-23 02:38:52.226353
成都一公司车站免费发10万个口罩,2020-01-23 02:48:58.000547
陌生女孩为执勤民警送口罩,2020-01-23 03:29:16.837571
英国为武汉出发的直飞航班设立隔离区,2020-01-23 03:54:28.229264
李兰娟院士称普通民众暂不需要护目镜,2020-01-23 04:29:47.850845
医用外科口罩正确戴法,2020-01-23 04:29:47.850998
山东新增4例新型肺炎确诊病例,2020-01-23 04:29:47.851390
广东发现6起家庭聚集性疫情,2020-01-23 04:34:50.926271
肺炎疫情下的春运,2020-01-23 04:39:53.084310
福建新增3例新型肺炎确诊病例,2020-01-23 04:44:54.646819
四川新增3例新型肺炎确诊病例,2020-01-23 04:44:54.646909
辽宁新增1例新型肺炎确诊病例,2020-01-23 05:10:08.789578
吉林确诊首例新型病毒肺炎病例,2020-01-23 05:15:11.434461
内蒙古发现1新型肺炎疑似病例,2020-01-23 05:25:16.270589
春节期间如何预防新型肺炎,2020-01-23 05:50:34.367222
湖南新增5例新型肺炎确诊病例,2020-01-23 05:55:37.847029
武汉新型肺炎防控指挥部第2号通告,2020-01-23 06:15:48.691139
抗非典护士再战新型肺炎,2020-01-23 06:30:56.400017
温州首例新型肺炎确诊患者基本痊愈,2020-01-23 06:46:04.597526
湖北高速开始封闭,2020-01-23 07:21:20.000293
口罩剪碎扔,2020-01-23 07:21:20.000494
的哥载了一位护士去金银潭医院,2020-01-23 07:36:26.601293
武汉确保加油站24小时营业,2020-01-23 07:36:26.601410
武汉24小时捐赠电话,2020-01-23 07:56:37.195870
新版新型肺炎诊疗方案公布,2020-01-23 08:11:44.795700
浙江新增17例新型肺炎确诊病例,2020-01-23 08:16:47.559940
说什么也不愿意戴口罩的固执长辈,2020-01-23 08:16:47.560044
经武汉邮件将进行二次消毒,2020-01-23 08:47:02.991766
武汉取消所有旅游团,2020-01-23 09:22:27.105848
暂停进入武汉的道路水路客运,2020-01-23 10:17:59.453363
深圳2名新型肺炎患者痊愈,2020-01-23 11:08:29.919859
新疆确诊2例新型肺炎,2020-01-23 11:28:40.907337
北京新增8例新型肺炎,2020-01-23 11:38:46.082605
武汉一名新型肺炎患者被成功救治,2020-01-23 11:43:51.042025
医护人员感染新型肺炎应认定工伤,2020-01-23 11:43:51.042180
陕西确诊3例新型肺炎,2020-01-23 11:48:53.869100
武汉全市影院暂停营业,2020-01-23 11:53:57.157620
李兰娟新型肺炎答疑10问,2020-01-23 11:58:59.528705
丁香医生,2020-01-23 12:44:25.964622
新型冠状病毒防护知识,2020-01-23 12:54:30.249632
湖北中小学开学确定延期,2020-01-23 13:14:42.743985
武汉7名医生在请战书上按下红手印,2020-01-23 13:24:46.353683
武汉封城后的市民生活,2020-01-23 13:34:53.215433
武汉86岁老专家坐轮椅出诊,2020-01-23 14:25:25.175592
小汤山非典医疗队请战书,2020-01-23 14:30:28.128338
武汉新冠肺炎社会捐赠方式,2020-01-23 14:30:28.128427
医生请战书,2020-01-23 14:35:32.177268
湖北回应涨价菜,2020-01-23 14:35:32.177488
武汉文娱场所暂停营业,2020-01-23 14:35:32.177564
防控肺炎父母不听劝怎么办,2020-01-23 14:35:32.177642
新型肺炎症状,2020-01-23 15:00:52.016575
新加坡确认首例新型冠状病毒病例,2020-01-23 15:00:52.016704
各地医生驰援湖北,2020-01-23 15:05:56.024871
江苏新增4例新冠肺炎,2020-01-23 15:11:00.475324
武汉将以小汤山模式建医院,2020-01-23 15:46:34.269129
甘肃确诊2例新型肺炎病例,2020-01-23 16:17:11.228404
财政部拨10亿补助湖北防控疫情,2020-01-23 17:08:09.028018
武汉网约出租车停止运营,2020-01-23 17:18:16.440193
快手向武汉市捐赠1亿元,2020-01-23 17:49:10.764697
河北1例新型肺炎病例死亡,2020-01-23 17:54:13.866619
湖北暂停全省旅行社经营活动,2020-01-23 19:10:09.657767
新型肺炎不构成国际突发卫生事件,2020-01-23 20:51:03.064411
湖北学校推迟开学时间,2020-01-24 00:17:37.778541
吸烟喝酒可抵抗疫情系谣言,2020-01-24 00:17:37.778749
广西新增8例新型肺炎,2020-01-24 00:47:52.526736
武汉女医护人员自发剪掉长发,2020-01-24 00:47:52.527039
武汉护士的朋友圈,2020-01-24 01:18:03.344243
英国出现4例新型肺炎疑似病例,2020-01-24 01:18:03.344442
全国确诊830例新型肺炎病例,2020-01-24 01:28:07.407922
为了让长辈戴口罩有多拼,2020-01-24 01:28:07.408669
专家组副组长自我治愈,2020-01-24 01:43:14.976005
从武汉回来请自行隔离,2020-01-24 01:48:17.329513
新型肺炎已治愈34例,2020-01-24 02:03:25.573774
河南新冠肺炎新增4例,2020-01-24 02:13:30.455073
山东新增3例新型肺炎,2020-01-24 02:28:38.678832
正确脱戴口罩方法,2020-01-24 02:33:40.585056
的哥给偶遇护士的祝福,2020-01-24 02:38:43.586823
广东累计家庭聚集性疫情10起,2020-01-24 02:43:46.092874
江西确诊7例,2020-01-24 02:53:51.019079
浙江确诊43例,2020-01-24 03:03:55.045856
重庆新增确诊18例,2020-01-24 03:03:55.046200
四川累计确诊15例,2020-01-24 03:03:55.046296
江苏确诊9例,2020-01-24 03:03:55.046487
成都小哥在地铁免费发口罩,2020-01-24 03:39:24.777602
湖北10市公共交通停运,2020-01-24 03:44:27.337347
海南省累计确诊8例新型肺炎,2020-01-24 03:44:27.337463
新型冠状病毒预防教程,2020-01-24 03:44:27.337671
湖北一家三口去山东过年被举报,2020-01-24 03:54:32.218325
湖北商务厅副厅长感染新冠病毒,2020-01-24 04:09:38.623172
钟南山任疫情应急科研攻关组长,2020-01-24 04:14:42.408420
武汉版小汤山开建,2020-01-24 04:14:42.408654
韩国确诊第二例新冠肺炎病例,2020-01-24 04:24:46.707109
疾病数学实验揭示防护措施有多重要,2020-01-24 04:39:52.893824
退掉返乡车票的湖北旅客,2020-01-24 04:54:58.753067
武汉关闭过江隧道,2020-01-24 05:05:02.025032
安徽确诊新冠肺炎15例,2020-01-24 05:15:07.825059
日本确诊2例新型肺炎病例,2020-01-24 05:25:11.898805
内蒙古确诊首例新冠肺炎,2020-01-24 05:30:13.371154
湖北启动一级响应,2020-01-24 05:50:22.412386
福建新增4例病例,2020-01-24 05:50:22.412897
广东严禁野生动物交易,2020-01-24 05:55:24.177006
湖南新增新型肺炎15例,2020-01-24 06:05:27.395404
武汉封城第一天,2020-01-24 06:05:27.395635
首株新型冠状病毒毒种信息公布,2020-01-24 06:25:35.577313
发热咳嗽非新冠肺炎唯一首发症状,2020-01-24 06:40:49.438280
山东累计确诊15例新型肺炎,2020-01-24 06:45:51.188036
口罩主力军,2020-01-24 06:45:51.188148
东京奥运会武汉站资格赛取消,2020-01-24 07:01:00.095746
向湖北武汉电视台捐赠电视剧版权,2020-01-24 07:06:01.837116
宁夏新型肺炎新增确诊1例,2020-01-24 07:11:07.632005
河南发布疫情预防短信,2020-01-24 07:16:09.379356
武汉协和医院最新治疗方案,2020-01-24 07:56:32.273521
辽宁累计确诊4例新型肺炎,2020-01-24 07:56:32.273634
湖北黄冈发布捐赠电话,2020-01-24 08:16:38.824523
防肺炎标语大全,2020-01-24 08:16:38.824742
北京1新冠肺炎确诊患者出院,2020-01-24 08:16:38.824851
封城日记,2020-01-24 08:36:51.948693
央视春晚临时增加抗肺炎诗朗诵,2020-01-24 08:46:56.075848
买不起口罩,2020-01-24 08:51:57.620851
武汉免费心理热线电话,2020-01-24 08:57:01.327537
武汉发热市民分级分类就医,2020-01-24 09:57:31.996334
医护人员把名字写在防护服上,2020-01-24 10:07:37.852150
青海首例新型肺炎疑似病例,2020-01-24 11:08:08.293462
新冠肺炎进入第二波流行上升期,2020-01-24 11:13:12.693785
武汉小汤山模式医院建设现场,2020-01-24 11:48:28.274104
武汉小汤山医院定名火神山医院,2020-01-24 13:04:03.917720
浙江首例确诊新型肺炎患者痊愈出院,2020-01-24 13:19:09.609269
150人医疗队出发赴武汉,2020-01-24 13:24:12.621781
废弃口罩的正确处理方法,2020-01-24 13:24:12.621901
江苏首批135人医疗队支援湖北,2020-01-24 13:24:12.622236
武汉医院收到匿名除夕饺子,2020-01-24 13:29:14.298086
上海首例确诊病例治愈出院,2020-01-24 13:54:25.929464
武汉版小汤山工人年夜饭,2020-01-24 13:59:27.645913
春晚抗肺炎朗诵看哭了,2020-01-24 14:09:32.700398
重症隔离病房中的除夕,2020-01-24 14:29:41.689622
陕西累计确诊5例新冠肺炎,2020-01-24 14:34:44.707813
武汉征集6000台出租车,2020-01-24 14:44:47.927735
北京累计确诊病例36例,2020-01-24 14:54:52.823993
武汉医生的年夜饭,2020-01-24 14:54:52.824103
医护人员隔离缓冲区拜年,2020-01-24 15:04:58.275709
首都机场大兴机场将对旅客体温检测,2020-01-24 15:20:07.229472
广东21名医护人员连夜赴武汉,2020-01-24 15:20:07.229797
武汉医院呼吁市民别送慰问品,2020-01-24 16:30:46.137884
除夕夜重庆135位医生奔赴武汉,2020-01-24 16:56:28.502401
云南新增新冠肺炎3例,2020-01-24 17:21:37.986549
春晚现场致敬一线医务人员,2020-01-24 17:21:37.986634
台湾确诊2例新冠肺炎,2020-01-24 17:36:45.914070
除夕夜的武汉,2020-01-24 18:02:01.913170
武汉多家医院物资紧张,2020-01-24 18:02:01.913278
武汉捐款,2020-01-24 18:17:11.872522
除夕夜空军3架运输机飞抵武汉,2020-01-24 18:52:34.016212
医生详述新冠肺炎治疗过程,2020-01-24 19:02:41.677408
150名解放军医护人员包机飞武汉,2020-01-25 00:25:00.609108
口罩不要随便扔,2020-01-25 00:25:00.609454
商务部紧急协调200多万只口罩,2020-01-25 00:25:00.609690
首个新冠病毒检测试剂盒通过检验,2020-01-25 00:55:11.716571
法国确诊2例新型肺炎病例,2020-01-25 01:00:13.194581
辽宁新增8例确诊病例,2020-01-25 01:20:22.492478
湖北累计报告新型肺炎病例729例,2020-01-25 01:45:32.958968
重庆累计确诊57例病例,2020-01-25 02:30:50.490110
广东发现1起工作同事聚集性疫情,2020-01-25 02:35:52.328302
新型肺炎已治愈38例,2020-01-25 02:40:54.682955
浙江新增19例确诊病例,2020-01-25 02:40:54.683035
河南新增23例确诊病例,2020-01-25 02:45:56.627979
医生挨个进隔离病房互相打气,2020-01-25 02:45:56.628087
梁武东医生因新冠肺炎去世,2020-01-25 03:06:05.590273
广东新增25例新型肺炎确诊病例,2020-01-25 03:06:05.590454
火神山医院将于2月1日建成,2020-01-25 03:06:05.590545
江苏新增9例确诊病例,2020-01-25 03:21:12.001638
新加坡抵杭州一架航班所有乘客隔离,2020-01-25 03:31:20.978290
河北新增6例新型肺炎确诊病例,2020-01-25 03:36:23.548771
四川新增13例确诊病例,2020-01-25 03:56:32.405337
湖南新增19例新型肺炎确诊病例,2020-01-25 04:16:41.094041
三所军医大学450人医疗队支援湖北,2020-01-25 04:26:47.097224
北京又一名新型肺炎患者痊愈出院,2020-01-25 04:36:52.048658
武汉85家酒店支援医护人员,2020-01-25 05:12:12.126060
最小新型肺炎确诊病例仅2岁,2020-01-25 05:32:21.140661
卫健委派1230人医疗队驰援武汉,2020-01-25 05:37:23.711524
钟南山称已有药物将用于临床治疗,2020-01-25 05:52:29.084034
辽宁累计确诊12例新型肺炎,2020-01-25 07:08:23.553588
武汉征用24家医院万张床位,2020-01-25 07:23:33.501701
最美逆行者驰援武汉,2020-01-25 07:23:33.501820
年初一凌晨4点丈夫送妻出征武汉,2020-01-25 07:38:53.759023
无条件收治所有疑似患者,2020-01-25 07:59:13.364790
武汉物资支援情况,2020-01-25 08:04:15.848950
从重查处口罩大幅涨价行为,2020-01-25 08:19:23.012857
甘肃新增2例确诊病例,2020-01-25 08:19:23.013066
陕西出现一名9岁新型肺炎病例,2020-01-25 08:29:29.496612
疫情应急运输车辆免费优先通行,2020-01-25 08:34:31.553797
交通部要求疫情防控物资优先通行,2020-01-25 08:39:33.591431
泰州一感染科医生离世,2020-01-25 08:44:36.677616
轻症患者居家隔离怎么做,2020-01-25 08:49:41.344631
浙江首批135名医护人员驰援武汉,2020-01-25 08:49:41.344738
急诊科医生,2020-01-25 08:54:42.904650
药店10只口罩卖850元将受高额处罚,2020-01-25 09:04:57.688889
湖南旺旺医院,2020-01-25 09:04:57.688978
广西20万副N95口罩发往武汉,2020-01-25 09:10:01.582008
武汉加油表情,2020-01-25 09:10:01.582122
武汉中心城区实行机动车禁行,2020-01-25 09:20:07.422217
日本确诊3例新型肺炎病例,2020-01-25 09:35:15.202668
香港新增3例新型肺炎确诊病例,2020-01-25 09:40:17.007653
上海关停3家野生动物交易场所,2020-01-25 09:50:26.415487
超级杯延期举行,2020-01-25 09:50:26.415916
农村疫情防控54字,2020-01-25 10:05:33.036021
最新疫情地图,2020-01-25 10:15:55.526570
湖北急需防控物资清单,2020-01-25 10:31:04.012383
武汉将再建一个小汤山医院,2020-01-25 10:31:04.012536
香港无限期暂停来往武汉航班高铁,2020-01-25 10:36:11.265743
武汉阻断武汉三镇间公共交通,2020-01-25 11:01:24.518013
微信开通疫情线索征集入口,2020-01-25 11:16:35.001219
十家快递企业绿色通道支援武汉,2020-01-25 11:46:55.900194
肺炎症状,2020-01-25 12:02:02.692208
武汉所有医院发热门诊24小时接诊,2020-01-25 12:12:07.575878
对症和中药治愈北京2例新型肺炎患者,2020-01-25 12:12:07.576114
天津确诊病例增至10例,2020-01-25 12:32:20.436759
华大基因捐赠10000份检测试剂,2020-01-25 12:42:24.751069
出入境时若有不适要主动申报,2020-01-25 12:47:27.812856
北京新型肺炎确诊病例41例,2020-01-25 13:12:39.820540
南京要求公共场所佩戴口罩,2020-01-25 13:12:39.820804
陶勇医生苏醒,2020-01-25 13:47:59.463598
30多种可能对新冠病毒有效药物,2020-01-25 13:58:05.498876
内蒙古7例疑似病例全部确诊,2020-01-25 14:03:09.751168
阿里10亿医疗物资专项基金,2020-01-25 14:13:15.158951
武汉市内交通部分解禁,2020-01-25 14:28:28.697688
湖北多地急需防疫物资捐助,2020-01-25 14:48:42.883343
党中央成立应对疫情领导工作小组,2020-01-25 14:48:42.883575
家庭版抗疫措施怎么做,2020-01-25 14:48:42.883691
广州城管局副局长被确诊新型肺炎,2020-01-25 15:08:59.866086
武汉ICU医生的心愿,2020-01-25 15:08:59.866177
福建新增8例确诊病例,2020-01-25 15:08:59.866268
湖北疫情防控举报方式,2020-01-25 15:14:02.157605
钟南山说动才动,2020-01-25 15:34:22.153373
香港将疫情应变级别提升至最高级,2020-01-25 15:39:28.780343
物资如何送进武汉,2020-01-25 15:44:32.561282
武汉人夜晚隔空喊话,2020-01-25 16:56:11.334957
央视记者武汉vlog,2020-01-25 16:56:11.335236
云南新增6例新型肺炎病例,2020-01-25 17:01:14.474690
黄石确诊31例新型肺炎,2020-01-25 17:16:44.432749
传染病学专家表示疫情已刻不容缓,2020-01-26 00:10:22.499946
医生请战书上的5个感叹号,2020-01-26 00:10:22.501033
黄冈版小汤山医院,2020-01-26 00:10:22.501218
如何劝爸妈重视疫情,2020-01-26 00:15:23.973865
武汉抗击新型肺炎疫情最新对策,2020-01-26 00:15:23.973962
北京三名医生感染新型肺炎,2020-01-26 00:20:25.649270
湖北累计新型肺炎1052例,2020-01-26 00:40:36.413618
武汉一餐馆24小时为医护人员送餐,2020-01-26 00:40:36.413735
抗艾滋病药物可试用新型肺炎,2020-01-26 00:50:41.156428
上海出现首例死亡病例,2020-01-26 01:31:00.507682
医护人员发放临时性工作补助,2020-01-26 01:36:03.884334
北京新增新型肺炎10例,2020-01-26 01:36:03.884627
河南新增51例确诊病例,2020-01-26 01:41:07.335260
辽宁累计确诊病例17例,2020-01-26 01:51:15.123197
山东新增确诊病例12例,2020-01-26 01:51:15.123534
湖北新型肺炎捐赠方式,2020-01-26 01:51:15.123616
浙江新增42例确诊病例,2020-01-26 02:11:26.703779
江苏新增13例确诊病例,2020-01-26 02:16:28.226881
安徽新增新型肺炎21例,2020-01-26 02:16:28.227223
广东新增新型肺炎20例,2020-01-26 02:36:37.921125
国内累计治愈出院病例49例,2020-01-26 02:36:37.921222
重庆新增新型肺炎18例,2020-01-26 02:41:40.490485
武汉病毒核酸日检测量预计可达2000份,2020-01-26 02:56:47.709183
多所高校延期开学,2020-01-26 03:01:52.003707
江西新增新型肺炎18例,2020-01-26 03:07:03.494762
医疗救援队,2020-01-26 03:17:08.409549
专家答疑如何预防新型肺炎,2020-01-26 03:22:12.678005
四川新增新型肺炎16例,2020-01-26 03:27:15.056805
